"A alma de meu filho Siquém __________ fortemente a vossa filha; dai-lha, peço-vos, por mulher. (Gênesis)","afeiçoou-se"
"Não podemos __________ p isto, dar a nossa irmã a um homem incircunciso; (Gênesis)","fazer"
"Mas se não nos __________, e não vos circuncidardes, levaremos nossa filha e nos iremos embora. (Gênesis)","ouvirdes"
"E suas palavras __________ a Hamor e a Siquém, seu filho. (Gênesis)","agradaram"
"Não tardou, pois, o mancebo em fazer isso, porque se __________ da filha de Jacó. (Gênesis)","agradava"
"O seu gado, as suas aquisições, e todos os seus animais, não serão __________? consintamos somente com eles, e habitarão conosco. (Gênesis)","nossos"
"E __________ ouvidos a Hamor e a Siquém, seu filho, todos os que saíam da porta da cidade; (Gênesis)","deram"
"Ao terceiro dia, quando os homens estavam doridos, dois filhos de Jacó, Simeão e Levi, irmãos de Diná, __________ cada um a sua espada, entraram na cidade com toda a segurança e mataram todo varão. (Gênesis)","tomaram"
"Mataram também ao fio da espada a Hamor e a Siquém, seu filho; e, tirando __________ da casa de Siquém, saíram. (Gênesis)","Diná"
"Então disse __________ a Simeão e a Levi: Tendes-me perturbado, fazendo-me odioso aos habitantes da terra, aos cananeus e perizeus. (Gênesis)","Jacó"
"Tendo eu pouca gente, __________ se ajuntarão e me ferirão; e serei destruído, eu com minha casa. (Gênesis)","eles"
"Devia ele __________ a nossa irmã como a uma prostituta? (Gênesis)","tratar"
"Assim chegou Jacó à Luz, que está na terra de Canaã (__________ é Betel), ele e todo o povo que estava com ele. (Gênesis)","esta"
"Então Raquel, ao sair-lhe a alma (porque morreu), __________ ao filho Benôni; (Gênesis)","chamou"
"Assim morreu __________, e foi sepultada no caminho de Efrata (esta é Bete-Leém). (Gênesis)","Raquel"
"E __________ erigiu uma coluna sobre a sua sepultura; (Gênesis)","Jacó"
"Quando __________ habitava naquela terra, foi Rúben e deitou-se com Bila, concubina de seu pai; (Gênesis)","Israel"
"Foram os dias de Isaque cento e oitenta anos; e, exalando o espírito, morreu e foi congregado ao seu povo, velho e cheio de dias; e Esaú e Jacó, seus filhos, o __________. (Gênesis)","sepultaram"
"Ada __________ de Esaú a Elifaz, e Basemate teve a Reuel; (Gênesis)","teve"
"Depois Esaú __________ suas mulheres, seus filhos, suas filhas e todas as almas de sua casa, seu gado, todos os seus animais e todos os seus bens, que havia adquirido na terra de Canaã, e foi-se para outra terra, apartando-se de seu irmão Jacó. (Gênesis)","tomou"
"Porque os seus bens eram __________ para habitarem juntos; (Gênesis)","abundantes demais"
"E os filhos de Elifaz __________: Temã, Omar, Zefô, Gatã e Quenaz. (Gênesis)","foram"
"Foram __________ os filhos de Reuel: Naate e Zerá, Sama e Mizá. (Gênesis)","estes"
"São __________ os chefes dos filhos de Esaú: dos filhos de Elifaz, o primogênito de Esaú, os chefes Temã, Omar, Zefô, Quenaz, Corá, Gatã e Amaleque. (Gênesis)","estes"
"São esses os chefes que nasceram a Elifaz na __________ de Edom; (Gênesis)","terra"
"São __________ os filhos de Seir, o horeu, moradores da terra: Lotã, Sobal, Zibeão, Anás, Disom, Eser e Disã; (Gênesis)","estes"
"São __________ os filhos de Ana: Disom e Aolíbama, filha de Ana. (Gênesis)","estes"
"São __________ os filhos de Disom: Hendã, Esbã, Itrã e Querã. (Gênesis)","estes"
"São __________ os reis que reinaram na terra de Edom, antes que reinasse rei algum sobre os filhos de Israel. (Gênesis)","estes"
"Estávamos nós __________ molhos no campo, e eis que o meu molho, levantando-se, ficou em pé; e os vossos molhos o rodeavam, e se inclinavam ao meu molho. (Gênesis)","atando"
"Por isso ainda mais o __________ por causa dos seus sonhos e das suas palavras. (Gênesis)","odiavam"
"Seus irmãos, pois, o invejavam; mas seu pai __________ o caso no seu coração. (Gênesis)","guardava"
"Ora, foram seus irmãos __________ o rebanho de seu pai, em Siquém. (Gênesis)","apascentar"
"Assim o enviou do __________ de Hebrom; e José foi a Siquém. (Gênesis)","vale"
"E um homem __________ a José, que andava errante pelo campo, e perguntou-lhe: Que procuras? (Gênesis)","encontrou"
"Não derrameis __________; lançai-o nesta cova, que está no deserto, e não lanceis mão nele. (Gênesis)","sangue"
"Logo que __________ chegou a seus irmãos, estes o despiram da sua túnica, a túnica de várias cores, que ele trazia; e tomando-o, lançaram-no na cova; (Gênesis)","José"
"De que nos __________ matar nosso irmão e encobrir o seu sangue? (Gênesis)","aproveita"
"Ao passarem os negociantes midianitas, __________ José, alçando-o da cova, e venderam-no por vinte siclos de prata aos ismaelitas, os quais o levaram para o Egito. (Gênesis)","tiraram"
"Ora, __________ voltou à cova, e eis que José não estava na cova; (Gênesis)","Rúben"
"E __________ todos os seus filhos e todas as suas filhas, para o consolarem; (Gênesis)","levantaram-se"
"Na verdade, com __________ hei de descer para meu filho até o Seol. (Gênesis)","choro"
"Os midianitas __________ José no Egito a Potifar, oficial de Faraó, capitão da guarda. (Gênesis)","venderam"
"Ela __________ e teve um filho, e o pai chamou-lhe Er. (Gênesis)","concebeu"
"Depois Judá __________ para Er, o seu primogênito, uma mulher, por nome Tamar. (Gênesis)","tomou"
"Onã, porém, __________ que tal descendência não havia de ser para ele; (Gênesis)","sabia"
"E o que ele __________ era mau aos olhos do Senhor, pelo que o matou também a ele. (Gênesis)","fazia"
"Assim se foi __________ e morou em casa de seu pai. (Gênesis)","Tamar"
"Com o correr do tempo, __________ a filha de Suá, mulher de Judá. (Gênesis)","morreu"
"Depois de consolado, __________ subiu a Timnate para ir ter com os tosquiadores das suas ovelhas, ele e Hira seu amigo, o adulamita. (Gênesis)","Judá"
"Eis que o teu sogro __________ a Timnate para tosquiar as suas ovelhas. (Gênesis)","sobe"
"Então ela __________ dos vestidos da sua viuvez e se cobriu com o véu, e assim envolvida, assentou-se à porta de Enaim que está no caminho de Timnate; (Gênesis)","se despiu"
"Ao vê-la, __________ julgou que era uma prostituta, porque ela havia coberto o rosto. (Gênesis)","Judá"
"Depois Judá __________ o cabrito por mão do seu amigo o adulamita, para receber o penhor da mão da mulher; (Gênesis)","enviou"
"Onde está __________ que estava em Enaim junto ao caminho? (Gênesis)","a prostituta"
"Mas o Senhor era com __________, e ele tornou-se próspero; e estava na casa do seu senhor, o egípcio. (Gênesis)","José"
"Desde que o pôs como __________ sobre a sua casa e sobre todos os seus bens, o Senhor abençoou a casa do egípcio por amor de José; e a bênção do Senhor estava sobre tudo o que tinha, tanto na casa como no campo. (Gênesis)","mordomo"
"Ora, __________ era formoso de porte e de semblante. (Gênesis)","José"
"E __________ destas coisas que a mulher do seu senhor pôs os olhos em José, e lhe disse: Deita-te comigo. (Gênesis)","aconteceu depois"
"Eis que o meu senhor __________ o que está comigo na sua casa, e entregou em minha mão tudo o que tem; (Gênesis)","não sabe"
"Como, pois, posso eu __________ este grande mal, e pecar contra Deus? (Gênesis)","cometer"
"Mas __________, certo dia, que entrou na casa para fazer o seu serviço; (Gênesis)","sucedeu"
"Mas ele, deixando a capa na mão dela, __________, escapando para fora. (Gênesis)","fugiu"
"Vem, deixa-me __________, aqui a sua capa e fugiu, escapando para fora. (Gênesis)","deixou"
"Ela __________ a capa consigo, até que o senhor dele voltou a casa. (Gênesis)","guardou"
"O servo __________, que nos trouxeste, veio a mim para me insultar; (Gênesis)","hebreu"
"Então o senhor de José o __________, e o lançou no cárcere, no lugar em que os presos do rei estavam encarcerados; (Gênesis)","tomou"
"O Senhor, porém, era com __________, estendendo sobre ele a sua benignidade e dando-lhe graça aos olhos do carcereiro, o qual entregou na mão de José todos os presos que estavam no cárcere; e era José quem ordenava tudo o que se fazia ali. (Gênesis)","José"
"E o carcereiro não tinha cuidado de coisa alguma que estava na mão de José, porquanto o Senhor era com ele, fazendo __________ tudo quanto ele empreendia. (Gênesis)","prosperar"
"Eis que em meu sonho __________ uma vide diante de mim, e na vide três sarmentos; (Gênesis)","havia"
"O copo de Faraó estava na minha mão; e, tomando as uvas, eu as espremia no __________ de Faraó e entregava o copo na mão de Faraó. (Gênesis)","copo"
"Mas __________ de mim, quando te for bem; usa, peço-te, de compaixão para comigo e faze menção de mim a Faraó e tira-me desta casa; (Gênesis)","lembra-te"
"Eu __________, e eis que três cestos de pão branco estavam sobre a minha cabeça. (Gênesis)","também sonhei"
"E no __________ mais alto havia para Faraó manjares de todas as qualidades que fazem os padeiros; (Gênesis)","cesto"
"E __________ ao terceiro dia, o dia natalício de Faraó, que este deu um banquete a todos os seus servos; e levantou a cabeça do copeiro-mor, e a cabeça do padeiro-mor no meio dos seus servos; (Gênesis)","aconteceu"
"Passados dois anos inteiros, __________ sonhou que estava em pé junto ao rio Nilo; (Gênesis)","Faraó"
"Após elas __________ do rio outras sete vacas, feias à vista e magras de carne; e paravam junto às outras vacas à beira do Nilo. (Gênesis)","subiam"
"E as vacas feias à vista e magras de carne __________ as sete formosas à vista e gordas. (Gênesis)","devoravam"
"Após elas __________ sete espigas miúdas e queimadas do vento oriental; (Gênesis)","brotavam"
"Estavam no __________ da casa de seu senhor, dizendo vossos semblantes tão tristes hoje? (Gênesis)","cárcere"
"Estava __________ um moço hebreu, servo do capitão da guarda, e contamos-lhe os sonhos, e ele interpretou os nossos sonhos, a cada um interpretou conforme o seu sonho. (Gênesis)","ali conosco"
"Ele se barbeou, __________ de roupa e apresentou-se a Faraó. (Gênesis)","mudou"
"Mas de ti __________ dizer que, ouvindo contar um sonho, podes interpretá-lo. (Gênesis)","ouvi"
"Após elas __________ outras sete vacas, fracas, muito feias à vista e magras de carne, tão feias quais nunca vi em toda terra do Egito. (Gênesis)","subiam"
"As vacas magras e feias __________ as primeiras sete vacas gordas. (Gênesis)","devoravam"
"Mas depois de as terem consumido, não se podia __________ que as houvessem consumido; (Gênesis)","reconhecer"
"Após elas __________ sete espigas secas, miúdas e queimadas do vento oriental. (Gênesis)","brotavam"
"As sete espigas __________ devoravam as sete espigas boas. (Gênesis)","miúdas"
"As sete vacas boas são sete anos, e as sete espigas boas também são sete anos; __________ é um só. (Gênesis)","o sonho"
"Depois deles __________-ão sete anos de fome, e toda aquela fartura será esquecida na terra do Egito, e a fome consumirá a terra. (Gênesis)","levantar-se"
"Não será conhecida a abundância na terra, por causa daquela fome que seguirá; __________ será gravíssima. (Gênesis)","porquanto"
"Portanto, __________ agora Faraó de um homem entendido e sábio, e o ponha sobre a terra do Egito. (Gênesis)","proveja-se"
"Poderíamos __________ um homem como este, em quem haja o espírito de Deus? (Gênesis)","achar"
"Tu estarás sobre a minha casa, e por tua voz __________ todo o meu povo; (Gênesis)","se governará"
"E __________ tirou da mão o seu anel-sinete e pô-lo na mão de José, vestiu-o de traje de linho fino, e lhe pôs ao pescoço um colar de ouro. (Gênesis)","Faraó"
"Ora, __________ era da idade de trinta anos, quando se apresentou a Faraó, rei do Egito. (Gênesis)","José"
"E __________ José da presença de Faraó e passou por toda a terra do Egito. (Gênesis)","saiu"
"Durante os sete anos de fartura a terra __________ com abundância; e José ajuntou todo o mantimento dos sete anos, que houve na terra do Egito, e o guardou nas cidades; (Gênesis)","produziu"
"Antes que __________ o ano da fome, nasceram a José dois filhos, que lhe deu Asenate, filha de Potífera, sacerdote de Om. (Gênesis)","viesse"
"Depois toda a __________ do Egito teve fome, e o povo clamou a Faraó por pão; (Gênesis)","terra"
"De __________ que, havendo fome sobre toda a terra, abriu José todos os depósitos, e vendia aos egípcios; (Gênesis)","modo"
"Também de todas as __________ vinham ao Egito, para comprarem de José; (Gênesis)","terras"
"Então desceram os dez irmãos de José, para comprarem __________ no Egito. (Gênesis)","trigo"
"Para que, porventura, não lhe __________ algum desastre. (Gênesis)","suceda"
"Assim entre os que iam lá, foram __________ de Israel para comprar, porque havia fome na terra de Canaã. (Gênesis)","os filhos"
"Vós __________ espias, e viestes para ver a nudez da terra. (Gênesis)","sois"
"Nós, teus servos, somos __________, filhos de um homem da terra de Canaã; (Gênesis)","doze irmãos"
"Se __________ homens de retidão, que fique um dos irmãos preso na casa da vossa prisão; (Gênesis)","sois"
"Nós, na verdade, somos __________ no tocante a nosso irmão, porquanto vimos a angústia da sua alma, quando nos rogava, e não o quisemos atender; (Gênesis)","culpados"
"E __________ não sabiam que José os entendia, porque havia intérprete entre eles. (Gênesis)","eles"
"Então ordenou José que __________ enchessem de trigo os sacos, que lhes restituíssem o dinheiro a cada um no seu saco, e lhes dessem provisões para o caminho. (Gênesis)","lhes"
"Quando um deles __________ o saco, para dar forragem ao seu jumento na estalagem, viu o seu dinheiro, pois estava na boca do saco. (Gênesis)","abriu"
"Meu dinheiro foi-me __________; ei-lo aqui no saco. (Gênesis)","devolvido"
"O homem, o senhor da terra, __________ asperamente, e tratou-nos como espias da terra; (Gênesis)","falou-nos"
"Deixai __________ de vossos irmãos, levai trigo para a fome de vossas casas, e parti, e trazei-me vosso irmão mais novo; (Gênesis)","comigo um"
"E __________ que, despejando eles os sacos, eis que o pacote de dinheiro de cada um estava no seu saco; (Gênesis)","aconteceu"
"Se lhe __________ algum desastre pelo caminho em que fordes, fareis descer minhas cãs com tristeza ao Seol. (Gênesis)","suceder"
"Se __________ enviar conosco o nosso irmão, desceremos e te compraremos alimento; (Gênesis)","queres"
"Por que me __________ este mal, fazendo saber ao homem que tínheis ainda outro irmão? (Gênesis)","fizeste"
"Se eu to __________, e o não puser diante de ti, serei réu de crime para contigo para sempre. (Gênesis)","não trouxer"
"E se não nos tivéssemos __________, certamente já segunda vez estaríamos de volta. (Gênesis)","demorado"
"Então os homens __________ medo, por terem sido levados à casa de José; (Gênesis)","tiveram"
"Ai! senhor meu, na __________ descemos dantes a comprar mantimento; e quando chegamos à estalagem, abrimos os nossos sacos, e eis que o dinheiro de cada um estava na boca do seu saco, nosso dinheiro por seu peso; e tornamos a trazê-lo em nossas mãos; (Gênesis)","verdade"
"Depois levou os homens à __________ de José, e deu-lhes água, e eles lavaram os pés; (Gênesis)","casa"
"Então __________ prepararam o presente para quando José viesse ao meio-dia; (Gênesis)","eles"
"Quando __________ chegou em casa, trouxeram-lhe ali o presente que guardavam junto de si; (Gênesis)","José"
"Então ele __________ perguntou como estavam; e prosseguiu: vosso pai, o ancião de quem falastes, está bem? (Gênesis)","lhes"
"É __________ o vosso irmão mais novo de quem me falastes? (Gênesis)","este"
"E __________: Deus seja benévolo para contigo, meu filho. (Gênesis)","disse"
"E __________ apressou-se, porque se lhe comoveram as entranhas por causa de seu irmão, e procurou onde chorar; (Gênesis)","José"
"Então ele __________ apresentou as porções que estavam diante dele; (Gênesis)","lhes"
"E a minha taça de prata porás na boca do saco do __________, com o dinheiro do seu trigo. (Gênesis)","mais novo"
"Assim fez ele conforme a palavra que __________ havia dito. (Gênesis)","José"
"Logo que veio a luz da manhã, foram __________ os homens, eles com os seus jumentos. (Gênesis)","despedidos"
"Não é __________ a taça por que bebe meu senhor, e de que se serve para adivinhar? (Gênesis)","esta"
"Então ele, tendo-os alcançado, __________ falou essas mesmas palavras. (Gênesis)","lhes"
"Longe estejam __________ servos de fazerem semelhante coisa. (Gênesis)","teus"
"Eis que o dinheiro, que achamos nas bocas dos nossos sacos, to tornamos a __________ desde a terra de Canaã; (Gênesis)","trazer"
"Aquele dos __________ servos com quem a taça for encontrada, morra; e ainda nós seremos escravos do meu senhor. (Gênesis)","teus"
"Então __________ se apressaram cada um a pôr em terra o seu saco, e cada um a abri-lo. (Gênesis)","eles"
"E o despenseiro __________, começando pelo maior, e acabando pelo mais novo; (Gênesis)","buscou"
"A menos que desça convosco vosso irmão mais novo, __________ a minha face. (Gênesis)","nunca mais vereis"
"Agora, pois, se eu for ter com o teu servo, meu pai, e o menino não estiver conosco, como a sua alma está ligada com a alma dele, __________ que, vendo ele que o menino ali não está, morrerá; (Gênesis)","acontecerá"
"Se eu to não trouxer de volta, serei __________, para com meu pai para sempre. (Gênesis)","culpado"
"Agora, pois, __________ teu servo em lugar do menino como escravo de meu senhor, e que suba o menino com seus irmãos. (Gênesis)","fique"
"Porque, como subirei eu a meu pai, se o menino não for __________? (Gênesis)","comigo"
"E __________ a voz em choro, de maneira que os egípcios o ouviram, bem como a casa de Faraó. (Gênesis)","levantou"
"E seus irmãos não lhe __________ responder, pois estavam pasmados diante dele. (Gênesis)","puderam"
"Eu sou __________, vosso irmão, a quem vendestes para o Egito. (Gênesis)","José"
"Agora, pois, não vos __________, nem vos aborreçais por me haverdes vendido para cá; porque para preservar vida é que Deus me enviou adiante de vós. (Gênesis)","entristeçais"
"Porque __________ dois anos de fome na terra, e ainda restam cinco anos em que não haverá lavoura nem sega. (Gênesis)","já houve"
"Assim não fostes vós que me __________ para cá, senão Deus, que me tem posto por pai de Faraó, e por senhor de toda a sua casa, e como governador sobre toda a terra do Egito. (Gênesis)","enviastes"
"Eis que os vossos __________, e os de meu irmão Benjamim, vêem que é minha boca que vos fala. (Gênesis)","olhos"
"E __________ beijou a todos os seus irmãos, chorando sobre eles; (Gênesis)","José"
"E não vos __________ coisa alguma das vossas alfaias; (Gênesis)","pese"
"E a seu pai __________ o seguinte: dez jumentos carregados do melhor do Egito, e dez jumentas carregadas de trigo, pão e provisão para seu pai, para o caminho. (Gênesis)","enviou"
"E o seu coração __________, porque não os acreditava. (Gênesis)","desmaiou"
"Eu __________ contigo para o Egito, e certamente te farei tornar a subir; e José porá a sua mão sobre os teus olhos. (Gênesis)","descerei"
"Também tomaram o seu gado e os seus bens que tinham adquirido na __________ de Canaã, e vieram para o Egito, Jacó e toda a sua descendência com ele. (Gênesis)","terra"
"Os seus filhos e os filhos de seus filhos com ele, as suas filhas e as filhas de seus filhos, e toda a sua descendência, __________ consigo para o Egito. (Gênesis)","levou-os"
"São __________ os nomes dos filhos de Israel, que vieram para o Egito, Jacó e seus filhos: Rúben, o primogênito de Jacó. (Gênesis)","estes"
"E __________ de Rúben: Hanoque, Palu, Hezrom e Carmi. (Gênesis)","os filhos"
"E __________ de Simeão: Jemuel, Jamim, Oade, Jaquim, Zoar, e Saul, filho de uma mulher cananéia. (Gênesis)","os filhos"
"E os filhos de Pérez foram __________ e Hamul, E os filhos de Issacar: Tola, Puva, Iobe e Sinrom. (Gênesis)","Hezrom"
"E __________ de Gade: Zifiom, Hagui, Suni, Ezbom, Eri, Arodi e Areli. (Gênesis)","os filhos"
"E __________ a José na terra do Egito Manassés e Efraim, que lhe deu Asenate, filha de Potífera, sacerdote de Om. (Gênesis)","nasceram"
"E __________ de Benjamim: Belá, Bequer, Asbel, Gêra, Naamã, Eí, Ros, Mupim, Hupim e Arde. (Gênesis)","os filhos"
"Todas as almas que vieram com Jacó para o Egito e que saíram da sua coxa, fora as mulheres dos filhos de Jacó, eram __________ sessenta e seis almas; (Gênesis)","todas"
"Todas as almas da casa de Jacó, que vieram para o Egito eram __________. (Gênesis)","setenta"
"Ora, __________ enviou Judá adiante de si a José, para o encaminhar a Gósen; e chegaram à terra de Gósen. (Gênesis)","Jacó"
"Meus irmãos e a casa de meu pai, que estavam na __________ de Canaã, vieram para mim. (Gênesis)","terra"
"Os homens são __________, que se ocupam em apascentar gado; e trouxeram os seus rebanhos, o seu gado e tudo o que têm. (Gênesis)","pastores"
"Nós, teus servos, temos sido __________ de gado desde a nossa mocidade até agora, tanto nós como nossos pais. (Gênesis)","pastores"
"Meu pai e meus irmãos, com seus rebanhos e seu gado, e __________ o que têm, chegaram da terra de Canaã e estão na terra de Gósen. (Gênesis)","tudo"
"E __________ dentre seus irmãos cinco homens e os apresentou a Faraó. (Gênesis)","tomou"
"Que ocupação é a vossa; Responderam-lhe: Nós, teus servos, somos __________ de ovelhas, tanto nós como nossos pais. (Gênesis)","pastores"
"E se sabes que entre eles há homens capazes, __________ sobre os pastores do meu gado. (Gênesis)","põe-nos"
"Também José __________ a Jacó, seu pai, e o apresentou a Faraó; e Jacó abençoou a Faraó. (Gênesis)","introduziu"
"Os dias dos anos das minhas peregrinações são __________ e trinta anos; poucos e maus têm sido os dias dos anos da minha vida, e não chegaram aos dias dos anos da vida de meus pais nos dias das suas peregrinações. (Gênesis)","cento"
"E __________ abençoou a Faraó, e saiu da sua presença. (Gênesis)","Jacó"
"E __________ sustentou de pão seu pai, seus irmãos e toda a casa de seu pai, segundo o número de seus filhos. (Gênesis)","José"
"Ora, não havia pão em toda a terra, porque a fome era mui __________; (Gênesis)","grave"
"Quanto ao povo, __________ fê-lo passar às cidades, desde uma até a outra extremidade dos confins do Egito. (Gênesis)","José"
"Somente a terra dos sacerdotes não a __________, porquanto os sacerdotes tinham rações de Faraó, e eles comiam as suas rações que Faraó lhes havia dado; (Gênesis)","comprou"
"Hoje vos tenho __________ a vós e a vossa terra para Faraó; (Gênesis)","comprado"
"Há de ser, porém, que no __________ as colheitas dareis a quinta parte a Faraó, e quatro partes serão vossas, para semente do campo, e para o vosso mantimento e dos que estão nas vossas casas, e para o mantimento de vossos filhinho. (Gênesis)","tempo"
"E __________ viveu na terra do Egito dezessete anos; (Gênesis)","Jacó"
"E esforçando-se __________, sentou-se sobre a cama. (Gênesis)","Israel"
"Eis que te __________ frutificar e te multiplicarei; tornar-te-ei uma multidão de povos e darei esta terra à tua descendência depois de ti, em possessão perpétua. (Gênesis)","farei"
"Quando eu vinha de Padã, __________ Raquel no caminho, na terra de Canaã, quando ainda faltava alguma distância para chegar a Efrata; (Gênesis)","morreu-me"
"Os olhos de Israel, porém, se tinham __________ por causa da velhice, de modo que não podia ver. (Gênesis)","escurecido"
"E __________ tomou os dois, a Efraim com a sua mão direita, à esquerda de Israel, e a Manassés com a sua mão esquerda, à direita de Israel, e assim os fez chegar a ele. (Gênesis)","José"
"Mas __________, estendendo a mão direita, colocou-a sobre a cabeça de Efraim, que era o menor, e a esquerda sobre a cabeça de Manassés, dirigindo as mãos assim propositadamente, sendo embora este o primogênito. (Gênesis)","Israel"
"O Deus em cuja presença __________ os meus pais Abraão e Isaque, o Deus que tem sido o meu pastor durante toda a minha vida até este dia, o anjo que me tem livrado de todo o mal, abençoe estes mancebos, e seja chamado neles o meu nome, e o nome de meus pois Abraão e Isaque; e multipliquem-se abundantemente no meio da terra. (Gênesis)","andaram"
"Nãa assim, meu pai, porque __________ é o primogênito; (Gênesis)","este"
"Descomedido como a água, __________ a preeminência; (Gênesis)","não reterás"
"Ele se __________ e se deita como um leão, e como uma leoa; (Gênesis)","encurva"
"Atando ele o seu jumentinho à vide, e o filho da sua jumenta à videira seleta, __________ as suas roupas em vinho e a sua vestidura em sangue de uvas. (Gênesis)","lava"
"Os olhos serão __________ pelo vinho, e os dentes brancos de leite. (Gênesis)","escurecidos"
"Dã __________ o seu povo, como uma das tribos de Israel. (Gênesis)","julgará"
"Os flecheiros lhe __________ amargura, e o flecharam e perseguiram, mas o seu arco permaneceu firme, e os seus braços foram fortalecidos pelas mãos do Poderoso de Jacó, o Pastor, o Rochedo de Israel, pelo Deus de teu pai, o qual te ajudará, e pelo Todo-Poderoso, o qual te abençoara, com bênçãos dos céus em cima, com bênçãos do abismo que jaz embaixo, com bênçãos dos seios e da madre. (Gênesis)","deram"
"As bênçãos de teu pai __________ as bênçãos dos montes eternos, as coisas desejadas dos eternos outeiros; (Gênesis)","excedem"
"E __________ ordenou a seus servos, os médicos, que embalsamassem a seu pai; (Gênesis)","José"
"Agora, pois, deixa-me subir, peço-te, e sepultar meu pai; __________. (Gênesis)","então voltarei"
"E __________ com ele tanto carros como gente a cavalo; (Gênesis)","subiram"
