"Naquelas pedras __________ todas as palavras desta lei, gravando-as bem nitidamente. (Deuteronômio)","escreverás"
"Quando __________ passado o Jordão, estes estarão sobre o monte Gerizim, para abençoarem o povo: Simeão, Levi, Judá, Issacar, José e Benjamim; (Deuteronômio)","houverdes"
"Maldito aquele que remover os marcos do __________. (Deuteronômio)","seu próximo"
"E todo o povo __________: Amém, Maldito aquele que se deitar com a mulher de seu pai, porquanto levantou a cobertura de seu pai. (Deuteronômio)","dirá"
"Se ouvires atentamente a voz do Senhor teu Deus, tendo cuidado de guardar todos os seus mandamentos que eu hoje te ordeno, o Senhor teu Deus te __________ sobre todas as nações da terra; (Deuteronômio)","exaltará"
"Bendito __________ na cidade, e bendito serás no campo. (Deuteronômio)","serás"
"Bendito __________ quando entrares, e bendito serás quando saíres. (Deuteronômio)","serás"
"O Senhor __________, feridos diante de ti, os teus inimigos que se levantarem contra ti; (Deuteronômio)","entregará"
"O Senhor __________ que a bênção esteja contigo nos teus celeiros e em tudo a que puseres a tua mão; (Deuteronômio)","mandará"
"O Senhor te __________ para si por povo santo, como te jurou, se guardares os mandamentos do Senhor teu Deus e andares nos seus caminhos. (Deuteronômio)","confirmará"
"Assim todos os povos da terra __________ que és chamado pelo nome do Senhor, e terão temor de ti. (Deuteronômio)","verão"
"E o Senhor te __________ prosperar grandemente no fruto do teu ventre, no fruto dos teus animais e no fruto do teu solo, na terra que o Senhor, com juramento, prometeu a teus pais te dar. (Deuteronômio)","fará"
"O Senhor te __________ o seu bom tesouro, o céu, para dar à tua terra a chuva no seu tempo, e para abençoar todas as obras das tuas mãos; e emprestarás a muitas nações, porém tu não tomarás emprestado. (Deuteronômio)","abrirá"
"E o Senhor te __________ por cabeça, e não por cauda; e só estarás por cima, e não por baixo; (Deuteronômio)","porá"
"Maldito __________ na cidade, e maldito serás no campo. (Deuteronômio)","serás"
"Maldito __________ ao entrares, e maldito serás ao saíres. (Deuteronômio)","serás"
"O Senhor __________ sobre ti a maldição, a derrota e o desapontamento, em tudo a que puseres a mão para fazer, até que sejas destruído, e até que repentinamente pereças, por causa da maldade das tuas obras, pelas quais me deixaste. (Deuteronômio)","mandará"
"O Senhor __________ pegar em ti a peste, até que te consuma da terra na qual estás entrando para a possuíres. (Deuteronômio)","fará"
"O céu que está sobre a tua __________ será de bronze, e a terra que está debaixo de ti será de ferro. (Deuteronômio)","cabeça"
"O Senhor __________ que sejas ferido diante dos teus inimigos; (Deuteronômio)","fará"
"Os teus cadáveres __________ de pasto a todas as aves do céu, e aos animais da terra, e não haverá quem os enxote. (Deuteronômio)","servirão"
"O Senhor te __________ com as úlceras do Egito, com tumores, com sarna e com coceira, de que não possas curar-te; (Deuteronômio)","ferirá"
"Desposar-te-ás com uma mulher, porém outro homem __________ com ela; (Deuteronômio)","dormirá"
"O teu boi será __________ na tua presença, porém dele não comerás; (Deuteronômio)","morto"
"Teus filhos e tuas filhas serão __________ a outro povo, os teus olhos o verão, e desfalecerão de saudades deles todo o dia; (Deuteronômio)","dados"
"Com úlceras malignas, de que não possas sarar, o Senhor te __________ nos joelhos e nas pernas, sim, desde a planta do pé até o alto da cabeça. (Deuteronômio)","ferirá"
"O Senhor te __________ a ti e a teu rei, que tiveres posto sobre ti, a uma nação que não conheceste, nem tu nem teus pais; e ali servirás a outros deuses, ao pau e à pedra. (Deuteronômio)","levará"
"E __________ a ser por pasmo, provérbio e ludíbrio entre todos os povos a que o Senhor te levar. (Deuteronômio)","virás"
"Levarás muita semente para o teu campo, __________ colherás pouco; (Deuteronômio)","porem"
"Todo o __________ e o fruto do teu solo consumi-los-á o gafanhoto. (Deuteronômio)","teu arvoredo"
"O estrangeiro que está no meio de ti __________ cada vez mais sobre ti, e tu cada vez mais descerás; (Deuteronômio)","se elevará"
"Todas estas maldições __________ sobre ti, e te perseguirão, e te alcançarão, até que sejas destruído, por não haveres dado ouvidos à voz do Senhor teu Deus, para guardares os seus mandamentos, e os seus estatutos, que te ordenou. (Deuteronômio)","virão"
"O Senhor __________ contra ti de longe, da extremidade da terra, uma nação que voa como a águia, nação cuja língua não entenderás; (Deuteronômio)","levantará"
"E, no __________ e no aperto com que os teus inimigos te apertarão, comerás o fruto do teu ventre, a carne de teus filhos e de tuas filhas, que o Senhor teu Deus te houver dado. (Deuteronômio)","cerco"
"Quanto ao homem mais mimoso e delicado no meio de ti, o seu olho será __________ para com o seu irmão, para com a mulher de seu regaço, e para com os filhos que ainda lhe ficarem de resto; (Deuteronômio)","mesquinho"
"Igualmente, quanto à mulher mais mimosa e delicada no meio de ti, que de mimo e delicadeza nunca tentou pôr a planta de seu pé sobre a terra, será __________ o seu olho para com o homem de seu regaço, para com seu filho, e para com sua filha; (Deuteronômio)","mesquinho"
"Se __________ cuidado de guardar todas as palavras desta lei, que estão escritas neste livro, para temeres este nome glorioso e temível, o Senhor teu Deus; (Deuteronômio)","não tiveres"
"Também o Senhor __________ vir a ti toda enfermidade, e toda praga que não está escrita no livro desta lei, até que sejas destruído. (Deuteronômio)","fará"
"E __________ que, assim como o Senhor se deleitava em vós, para fazer-vos o bem e multiplicar-vos, assim o Senhor se deleitará em destruir-vos e consumir-vos; (Deuteronômio)","será"
"E o Senhor vos __________ entre todos os povos desde uma extremidade da terra até a outra; e ali servireis a outros deuses que não conhecestes, nem vós nem vossos pais, deuses de pau e de pedra. (Deuteronômio)","espalhará"
"E nem ainda entre estas nações descansarás, nem a planta de teu pé __________ repouso; (Deuteronômio)","terá"
"E a tua vida estará __________ em suspenso diante de ti; (Deuteronômio)","como"
"Ali vos __________ a venda como escravos e escravas aos vossos inimigos, mas não haverá quem vos compre. (Deuteronômio)","poreis"
"Estas são __________ do pacto que o Senhor ordenou a Moisés que fizesse com os filhos de Israel na terra de Moabe, além do pacto que fizera com eles em Horebe. (Deuteronômio)","as palavras"
"Mas até hoje o Senhor não vos __________ um coração para entender, nem olhos para ver, nem ouvidos para ouvir. (Deuteronômio)","tem dado"
"Quando, pois, viemos a este lugar, Siom, rei de Hesbom, e Ogue, rei de Basã, nos __________ ao encontro, à peleja, e nós os ferimos; (Deuteronômio)","saíram"
", a saber, todos os homens de Israel, os vossos pequeninos, as vossas mulheres, e o estrangeiro que está no __________ do vosso arraial, tanto o rachador da vossa lenha como o tirador da vossa água; (Deuteronômio)","meio"
"Ora, não é __________ que faço este pacto e este juramento, mas é com aquele que hoje está aqui conosco perante o Senhor nosso Deus, e também com aquele que hoje não está aqui conosco (porque vós sabeis como habitamos na terra do Egito, e como passamos pelo meio das nações, pelas quais passastes; (Deuteronômio)","somente convosco"
"O Senhor não lhe __________ perdoar, pelo contrário fumegará contra esse homem a ira do Senhor, e o seu zelo, e toda maldição escrita neste livro pousará sobre ele, e o Senhor lhe apagará o nome de debaixo do céu. (Deuteronômio)","quererá"
"Assim o Senhor o __________ para mal, dentre todas as tribos de Israel, conforme todas as maldições do pacto escrito no livro desta lei. (Deuteronômio)","separará"
"Pelo que a geração vindoura-os vossos filhos que se levantarem depois de vós-e o estrangeiro que vier de terras remotas __________, ao verem as pragas desta terra, e as suas doenças, com que o Senhor a terá afligido, e que toda a sua terra é enxofre e sal e abrasamento, de sorte que não será semeada, e nada produzirá, nem nela crescerá erva alguma, assim como foi a destruição de Sodoma e de Gomorra, de Admá e de Zeboim, que o Senhor destruiu na sua ira e no seu furor; (Deuteronômio)","dirão"
"Porquanto __________ o pacto do Senhor, o Deus de seus pais, que tinha feito com eles, quando os tirou da terra do Egito; e se foram e serviram a outros deuses, e os adoraram; (Deuteronômio)","deixaram"
"As coisas encobertas __________ ao Senhor nosso Deus, mas as reveladas nos pertencem a nós e a nossos filhos para sempre, para que observemos todas as palavras desta lei. (Deuteronômio)","pertencem"
"Quando te sobrevierem todas estas coisas, a bênção ou a maldição, que pus diante de ti, e te recordares delas entre todas as nações para onde o Senhor teu Deus te houver lançado, e te converteres ao Senhor teu Deus, e obedeceres à sua voz conforme tudo o que eu te ordeno hoje, tu e teus filhos, de todo o teu coração e de toda a tua alma, o Senhor teu Deus te __________ voltar do teu cativeiro, e se compadecerá de ti, e tornará a ajuntar-te dentre todos os povos entre os quais te houver espalhado o senhor teu Deus. (Deuteronômio)","fará"
"Ainda que o teu desterro tenha sido para a extremidade do céu, desde ali te __________ o Senhor teu Deus, e dali te tomará; (Deuteronômio)","ajuntará"
"Também o Senhor teu Deus __________ o teu coração, e o coração de tua descendência, a fim de que ames ao Senhor teu Deus de todo o teu coração e de toda a tua alma, para que vivas. (Deuteronômio)","circuncidará"
"E o Senhor teu Deus __________ todas estas maldições sobre os teus inimigos, sobre aqueles que te tiverem odiado e perseguido. (Deuteronômio)","porá"
"Então o Senhor teu Deus te __________ prosperar grandemente em todas as obras das tuas mãos, no fruto do teu ventre, e no fruto dos teus animais, e no fruto do teu solo; (Deuteronômio)","fará"
"Porque este mandamento, que eu hoje te ordeno, não te é difícil demais, nem tampouco está __________ de ti. (Deuteronômio)","longe"
"Quem __________ por nós ao céu, e no-lo trará, e no-lo fará ouvir, para que o cumpramos? (Deuteronômio)","subirá"
"Nem está além do mar, para dizeres: Quem passará por nós além do mar, e no-lo __________, e no-lo fará ouvir, para que o cumpramos? (Deuteronômio)","trará"
"Mas a palavra está __________ de ti, na tua boca, e no teu coração, para a cumprires. (Deuteronômio)","mui perto"
"Vê que hoje te __________ de ti a vida e o bem, a morte e o mal. (Deuteronômio)","pus diante"
"Se guardares o mandamento que eu hoje te ordeno de amar ao Senhor teu Deus, de andar nos seus caminhos, e de guardar os seus mandamentos, os seus estatutos e os seus preceitos, então viverás, e te multiplicarás, e o Senhor teu Deus te __________ na terra em que estás entrando para a possuíres. (Deuteronômio)","abençoará"
"Mas se o teu coração __________, e não quiseres ouvir, e fores seduzido para adorares outros deuses, e os servires, declaro-te hoje que certamente perecerás; (Deuteronômio)","se desviar"
"Prosseguindo Moisés, __________ estas palavras a todo o Israel, dizendo-lhes: Cento e vinte anos tenho eu hoje. (Deuteronômio)","falou ainda"
"E o Senhor lhes __________ como fez a Siom e a Ogue, reis dos amorreus, e à sua terra, aos quais destruiu. (Deuteronômio)","fará"
"Quando, pois, o Senhor vo-los entregar, __________ com eles conforme todo o mandamento que vos tenho ordenado. (Deuteronômio)","fareis"
"Sê __________ e corajoso, porque tu entrarás com este povo na terra que o Senhor, com juramento, prometeu a teus pais lhes daria; (Deuteronômio)","forte"
"O Senhor, pois, é __________ que vai adiante de ti; (Deuteronômio)","aquele"
"Moisés __________ esta lei, e a entregou aos sacerdotes, filhos de Levi, que levavam a arca do pacto do Senhor, e a todos os anciãos de Israel. (Deuteronômio)","escreveu"
"Ao fim de cada sete anos, no tempo determinado do ano da remissão, na festa dos tabernáculos, quando todo o Israel vier a comparecer perante ao Senhor teu Deus, no __________ que ele escolher, lereis esta lei diante de todo o Israel, para todos ouvirem. (Deuteronômio)","lugar"
"Assim foram __________ e Josué, e se apresentaram na tenda da revelação. (Deuteronômio)","Moisés"
"Então o Senhor __________ na tenda, na coluna de nuvem; (Deuteronômio)","apareceu"
"Não é, __________, por não estar o meu Deus comigo, que me sobrevieram estes males? (Deuteronômio)","porventura"
"Agora, pois, escrevei para vós este cântico, e ensinai-o aos filhos de Israel; __________ na sua boca, para que este cântico me sirva por testemunha contra o povo de Israel. (Deuteronômio)","ponde-o"
"Porque o introduzirei na terra que, com juramento, __________ a seus pais, terra que mana leite e mel; (Deuteronômio)","prometi"
"E __________ que, quando lhe sobrevierem muitos males e angústias, então este cântico responderá contra ele por testemunha, pois não será esquecido da boca de sua descendência; porquanto conheço a sua imaginação, o que ele maquina hoje, antes de eu o ter introduzido na terra que lhe prometi com juramento. (Deuteronômio)","será"
"Assim Moisés __________ este cântico naquele dia, e o ensinou aos filhos de Israel. (Deuteronômio)","escreveu"
"Tomai este livro da lei, e ponde-o ao lado da arca do __________ do Senhor vosso Deus, para que ali esteja por testemunha contra vós. (Deuteronômio)","pacto"
"Porque __________ a vossa rebeldia e a vossa dura cerviz; (Deuteronômio)","conheço"
"Porque eu sei que __________ da minha morte certamente vos corrompereis, e vos desviareis do caminho que vos ordenei; (Deuteronômio)","depois"
"Porque __________ o nome do Senhor; engrandecei o nosso Deus. (Deuteronômio)","proclamarei"
"É __________ que recompensas ao Senhor, povo louco e insensato? (Deuteronômio)","assim"
"Quando o Altíssimo dava às nações a sua herança, quando separava os filhos dos homens, __________ os termos dos povos conforme o número dos filhos de Israel. (Deuteronômio)","estabeleceu"
"Porque a porção do Senhor é o seu povo; Jacó é __________ da sua herança. (Deuteronômio)","a parte"
"Como a águia desperta o seu ninho, adeja sobre os seus filhos e, estendendo as suas asas, __________, e os leva sobre as suas asas, assim só o Senhor o guiou, e não havia com ele deus estranho. (Deuteronômio)","toma-os"
"E Jesurum, engordando, __________ (tu engordaste, tu te engrossaste e te cevaste); (Deuteronômio)","recalcitrou"
"Esconderei deles o meu rosto, __________ será o seu fim, porque geração perversa são eles, filhos em quem não há fidelidade. (Deuteronômio)","verei qual"
"A zelos me __________ cem aquilo que não é Deus, com as suas vaidades me provocaram à ira; (Deuteronômio)","provocaram"
"Porque um fogo __________ na minha ira, e arde até o mais profundo do Seol, e devora a terra com o seu fruto, e abrasa os fundamentos dos montes. (Deuteronômio)","se acendeu"
"Males __________ sobre eles, esgotarei contra eles as minhas setas. (Deuteronômio)","amontoarei"
"Consumidos serão de __________, devorados de raios e de amarga destruição; (Deuteronômio)","fome"
"Por __________ a espada, e por dentro o pavor, tanto ao mancebo como à virgem, assim à criança de peito como ao homem encanecido. (Deuteronômio)","fora devastará"
"Porque são __________ de conselhos, e neles não há entendimento. (Deuteronômio)","gente falta"
"Se eles fossem sábios, __________ isso, e atentariam para o seu fim! (Deuteronômio)","entenderiam"
"Porque a sua rocha não é como __________, sendo até os nossos inimigos juízes disso. (Deuteronômio)","a nossa Rocha"
"Porque a sua vinha é da __________ de Sodoma e dos campos de Gomorra; (Deuteronômio)","vinha"
"O seu vinho é __________ de serpentes, e peçonha cruel de víboras. (Deuteronômio)","veneno"
"Minha é __________ e a recompensa, ao tempo em que resvalar o seu pé; (Deuteronômio)","a vingança"
"Porque o Senhor __________ ao seu povo, e se arrependerá no tocante aos seus servos, quando vir que o poder deles já se foi, e que não resta nem escravo nem livre. (Deuteronômio)","vindicará"
"Como eu vivo para sempre, se eu __________ a minha espada reluzente, e a minha mão travar do juízo, então retribuirei vingança aos meus adversários, e recompensarei aos que me odeiam. (Deuteronômio)","afiar"
"De sangue __________ as minhas setas, e a minha espada devorará carne; (Deuteronômio)","embriagarei"
"Pelo que verás a terra diante de ti, __________, na terra que eu dou aos filhos de Israel. (Deuteronômio)","porém lá não entrarás"
"Esta é a bênção com que Moisés, homem de Deus, __________ os filhos de Israel antes da sua morte. (Deuteronômio)","abençoou"
"O Senhor __________ do Sinai, e de Seir raiou sobre nós; (Deuteronômio)","veio"
"Moisés nos __________ uma lei, uma herança para a assembléia de Jacó. (Deuteronômio)","prescreveu"
"E __________ rei em Jesurum, quando se congregaram os cabeças do povo juntamente com as tribos de Israel. (Deuteronômio)","tornou-se"
"Ouve, ó Senhor, a voz de Judá e introduze-o no meio do __________; com as suas mãos pelejou por si; (Deuteronômio)","seu povo"
"Abençoa o seu poder, ó Senhor, e aceita a obra das suas mãos; __________ os lombos dos que se levantam contra ele e o odeiam, para que nunca mais se levantem. (Deuteronômio)","fere"
"Abençoada pelo Senhor seja __________, com os mais excelentes dons do céu, com o orvalho, e com as águas do abismo que jaz abaixo; (Deuteronômio)","a sua terra"
"Eis __________; ele tem majestade; e os seus chifres são chifres de boi selvagem; (Deuteronômio)","o seu novilho primogênito"
"Tais são as miríades de Efraim, e tais são __________ de Manassés. (Deuteronômio)","os milhares"
"De Zebulom __________: Zebulom, alegra-te nas tuas saídas; (Deuteronômio)","disse"
"Bendito aquele que faz dilatar a Gade; __________ como a leoa, e despedaça o braço, e o alto da cabeça. (Deuteronômio)","habita"
"Ele __________ da primeira parte, porquanto ali estava reservada a porção do legislador; (Deuteronômio)","se proveu"
"Bendito seja __________ dentre os filhos de Israel; (Deuteronômio)","Aser"
"O Deus eterno é __________ habitação, e por baixo estão os braços eternos; (Deuteronômio)","a tua"
"Israel __________, a fonte de Jacó a sós, na terra de grão e de mosto; (Deuteronômio)","pois habitará seguro"
"Assim Moisés, servo do Senhor, __________ na terra de Moabe, conforme o dito do Senhor, que o sepultou no vale, na terra de Moabe, defronte de Bete-Peor; (Deuteronômio)","morreu ali"
"Os filhos de Israel __________ a Moisés por trinta dias nas planícies de Moabe; (Deuteronômio)","prantearam"
"Todas as almas, pois, que procederam da coxa de Jacó, foram __________; José, porém, já estava no Egito. (Êxodo)","setenta"
"Depois os filhos de Israel frutificaram e aumentaram muito, multiplicaram-se e __________, de modo que a terra se encheu deles. (Êxodo)","tornaram-se sobremaneira fortes"
"Entrementes __________ sobre o Egito um novo rei, que não conhecera a José. (Êxodo)","se levantou"
"Eis que o povo de Israel é __________ e mais forte do que nos. (Êxodo)","mais numeroso"
"Eia, __________ de astúcia para com ele, para que não se multiplique, e aconteça que, vindo guerra, ele também se ajunte com os nossos inimigos, e peleje contra nós e se retire da terra. (Êxodo)","usemos"
"Assim os israelitas __________ para Faraó cidades armazéns, Pitom e Ramessés. (Êxodo)","edificaram"
"Mas quanto mais os egípcios __________ o povo de Israel, tanto mais este se multiplicava e se espalhava; (Êxodo)","afligiam"
"Por isso os egípcios __________ os filhos de Israel servir com dureza; (Êxodo)","faziam"
"Quando ajudardes no __________ as hebréias, e as virdes sobre os assentos, se for filho, matá-lo-eis; (Êxodo)","parto"
"As parteiras, porém, __________ a Deus e não fizeram como o rei do Egito lhes ordenara, antes conservavam os meninos com vida. (Êxodo)","temeram"
"Por que tendes __________ isto e guardado os meninos com vida? (Êxodo)","feito"
"É que as mulheres hebréias não são como __________; (Êxodo)","as egípcias"
"A todos os __________ que nascerem lançareis no rio, mas a todas as filhas guardareis com vida. (Êxodo)","filhos"
"Não podendo, porém, __________ por mais tempo, tomou para ele uma arca de juncos, e a revestiu de betume e pez; (Êxodo)","escondê-lo"
"E sua irmã __________ de longe, para saber o que lhe aconteceria. (Êxodo)","postou-se"
"A filha de Faraó __________ para banhar-se no rio, e as suas criadas passeavam à beira do rio. (Êxodo)","desceu"
"Vendo ela a arca no meio os juncos, __________ a sua criada buscá-la. (Êxodo)","mandou"
"Quando, pois, o menino era já grande, ela o __________ à filha de Faraó, a qual o adotou; (Êxodo)","trouxe"
"Ora, __________ naqueles dias que, sendo Moisés já homem, saiu a ter com seus irmãos e atentou para as suas cargas; e viu um egípcio que feria a um hebreu dentre, seus irmãos. (Êxodo)","aconteceu"
"E quando Faraó __________ disso, procurou matar a Moisés. (Êxodo)","soube"
"Este, porém, __________ da presença de Faraó, e foi habitar na terra de Midiã; (Êxodo)","fugiu"
"O sacerdote de Midiã __________ sete filhas, as quais vieram tirar água, e encheram os tanques para dar de beber ao rebanho de seu pai. (Êxodo)","tinha"
"Moisés, porém, __________ e as defendeu, e deu de beber ao rebanho delas. (Êxodo)","levantou-se"
"Então Moisés __________ em morar com aquele homem, o qual lhe deu sua filha Zípora. (Êxodo)","concordou"
"No __________ de muitos dias, morreu o rei do Egito; (Êxodo)","decorrer"
"Então Deus, ouvindo-lhes os gemidos, __________ do seu pacto com Abraão, com Isaque e com Jacó. (Êxodo)","lembrou-se"
"Ora, Moisés __________ o rebanho de Jetro, seu sogro, sacerdote de Midiã; (Êxodo)","estava apascentando"
"E __________ o anjo do Senhor em uma chama de fogo do meio duma sarça. (Êxodo)","apareceu-lhe"
"Moisés __________, e eis que a sarça ardia no fogo, e a sarça não se consumia; (Êxodo)","olhou"
"Agora me __________ para lá e verei esta maravilha, e por que a sarça não se queima. (Êxodo)","virarei"
"E vendo o Senhor que ele se virara para ver, __________ do meio da sarça, e disse: Moisés, Moisés! (Êxodo)","chamou-o"
"Eu sou __________ de teu pai, o Deus de Abraão, o Deus de Isaque, e o Deus de Jacó. (Êxodo)","o Deus"
"E Moisés __________ o rosto, porque temeu olhar para Deus. (Êxodo)","escondeu"
"Com efeito __________ a aflição do meu povo, que está no Egito, e tenho ouvido o seu clamor por causa dos seus exatores, porque conheço os seus sofrimentos; e desci para o livrar da mão dos egípcios, e para o fazer subir daquela terra para uma terra boa e espaçosa, para uma terra que mana leite e mel; (Êxodo)","tenho visto"
"E agora, eis que o clamor dos filhos de Israel é __________ a mim; (Êxodo)","vindo"
"O Senhor, o Deus de vossos pais, o Deus de Abraão, o Deus de Isaque, e o Deus de Jacó, me __________ a vós; (Êxodo)","enviou"
"Eu sei, porém, que __________ do Egito não vos deixará ir, a não ser por uma forte mão. (Êxodo)","o rei"
"E eu darei graça a este povo aos olhos dos egípcios; e acontecerá que, quando sairdes, __________. (Êxodo)","não saireis vazios"
"Porque cada mulher __________ à sua vizinha e à sua hóspeda jóias de prata e jóias de ouro, bem como vestidos, os quais poreis sobre vossos filhos e sobre vossas filhas; assim despojareis os egípcios. (Êxodo)","pedirá"
"Ele a __________ no chão, e ela se tornou em cobra; (Êxodo)","lançou"
"Estende a mão e pega-lhe pela cauda (__________ ele a mão e lhe pegou, e ela se tornou em vara na sua mão); (Êxodo)","estendeu"
"E quando a tirou, eis que a mão estava __________, branca como a neve. (Êxodo)","leprosa"
"E sucederá que, se eles não te crerem, nem atentarem para o primeiro sinal, __________ ao segundo sinal. (Êxodo)","crerão"
"E se ainda não crerem a estes dois sinais, nem ouvirem a tua voz, __________ da água do rio, e a derramarás sobre a terra seca; e a água que tomares do rio tornar-se-á em sangue sobre a terra seca. (Êxodo)","então tomarás"
"Ao que lhe __________ o Senhor: Quem faz a boca do homem? (Êxodo)","replicou"
"Ah, Senhor! __________, peço-te, por mão daquele a quem tu hás de enviar. (Êxodo)","envia"
"Eis que ele também te sai ao encontro, e vendo-te, __________ em seu coração. (Êxodo)","se alegrará"
"Deixa-me, peço-te, voltar a meus irmãos, que estão no Egito, para ver se __________. (Êxodo)","ainda vivem"
"Quando voltares ao Egito, vê que faças diante de Faraó todas as maravilhas que tenho posto na __________; (Êxodo)","tua mão"
"Ora, sucedeu no caminho, numa estalagem, que o Senhor o __________, e quis matá-lo. (Êxodo)","encontrou"
"E __________ Moisés a Arão todas as palavras com que o Senhor o enviara e todos os sinais que lhe mandara. (Êxodo)","relatou"
"Então foram __________ e Arão e ajuntaram todos os anciãos dos filhos de Israel; (Êxodo)","Moisés"
"E o povo creu; e quando ouviram que o Senhor __________ os filhos de Israel e que tinha visto a sua aflição, inclinaram-se, e adoraram. (Êxodo)","havia visitado"
"Quem é o Senhor, para que eu __________ a sua voz para deixar ir Israel? (Êxodo)","ouça"
"Eis que o povo da terra já é __________, e vós os fazeis abandonar as suas cargas. (Êxodo)","muito"
"Também lhes __________ a conta dos tijolos que dantes faziam; nada diminuireis dela; (Êxodo)","imporeis"
