"Seis dias __________, mas o sétimo dia será o sábado de descanso solene, santo ao Senhor; (Êxodo)","se trabalhará"
"Mas o povo, vendo que Moisés __________ em descer do monte, acercou-se de Arão, e lhe disse: Levanta-te, faze-nos um deus que vá adiante de nós; (Êxodo)","tardava"
"Então todo o povo, tirando os pendentes de ouro que estavam nas suas orelhas, os __________ a Arão; (Êxodo)","trouxe"
"No dia seguinte __________ cedo, ofereceram holocaustos, e trouxeram ofertas pacíficas; (Êxodo)","levantaram-se"
"Agora, pois, __________, para que a minha ira se acenda contra eles, e eu os consuma; (Êxodo)","deixa-me"
"Para mal os __________, para matá-los nos montes, e para destruí-los da face da terra?. (Êxodo)","tirou"
"Multiplicarei os vossos __________ como as estrelas do céu, e lhes darei toda esta terra de que tenho falado, e eles a possuirão por herança para sempre. (Êxodo)","descendentes"
"Então o Senhor se arrependeu do mal que dissera que havia de __________ ao seu povo. (Êxodo)","fazer"
"E __________ Moisés, e desceu do monte com as duas tábuas do testemunho na mão, tábuas escritas de ambos os lados; (Êxodo)","virou-se"
"E aquelas tábuas eram __________ de Deus; também a escritura era a mesma escritura de Deus, esculpida nas tábuas. (Êxodo)","obra"
"Não é __________ dos vitoriosos, nem alarido dos vencidos, mas é a voz dos que cantam que eu ouço. (Êxodo)","alarido"
"Então eu lhes __________: Quem tem ouro, arranque-o. (Êxodo)","disse"
"Assim mo __________; e eu o lancei no fogo, e saiu este bezerro. (Êxodo)","deram"
"Cada __________ a sua espada sobre a coxa; e passai e tornai pelo arraial de porta em porta, e mate cada um a seu irmão, e cada um a seu amigo, e cada um a seu vizinho. (Êxodo)","um ponha"
"E os filhos de Levi __________ conforme a palavra de Moisés; e caíram do povo naquele dia cerca de três mil homens. (Êxodo)","fizeram"
"Agora, pois, __________ o seu pecado; ou se não, risca-me do teu livro, que tens escrito. (Êxodo)","perdoa"
"E __________ um anjo adiante de ti (e lançarei fora os cananeus, e os amorreus, e os heteus, e os perizeus, e os heveus, e os jebuseus), para uma terra que mana leite e mel; (Êxodo)","enviarei"
"E quando o povo __________ esta má notícia, pôs-se a prantear, e nenhum deles vestiu os seus atavios. (Êxodo)","ouviu"
"Então os filhos de Israel __________ dos seus atavios, desde o monte Horebe em diante. (Êxodo)","se despojaram"
"Ora, Moisés __________ tomar a tenda e armá-la fora do arraial, bem longe do arraial; e chamou-lhe a tenda da revelação. (Êxodo)","costumava"
"E todo aquele que buscava ao Senhor __________ à tenda da revelação, que estava fora do arraial. (Êxodo)","saía"
"E quando Moisés __________ na tenda, a coluna de nuvem descia e ficava à porta da tenda; (Êxodo)","entrava"
"Assim via todo o povo a coluna de nuvem que estava __________, e todo o povo, levantando-se, adorava, cada um à porta da sua tenda. (Êxodo)","à porta da tenda"
"E __________ o Senhor a Moisés face a face, como qualquer fala com o seu amigo. (Êxodo)","falava"
"Se eu, pois, tenho achado graça aos teus olhos, rogo-te que agora me mostres os teus caminhos, para que eu te conheça, a fim de que ache graça aos teus olhos; e considera que esta nação é __________. (Êxodo)","teu povo"
"Se tu mesmo não fores conosco, não nos faças __________ daqui. (Êxodo)","subir"
"Como, pois, se saberá agora que __________ graça aos teus olhos, eu e o teu povo? (Êxodo)","tenho achado"
"Eu __________ passar toda a minha bondade diante de ti, e te proclamarei o meu nome Jeová; (Êxodo)","farei"
"Eis aqui __________ a mim; aqui, sobre a penha, te porás. (Êxodo)","um lugar junto"
"E quando a minha glória passar, eu te __________ numa fenda da penha, e te cobrirei com a minha mão, até que eu haja passado. (Êxodo)","porei"
"Depois, quando eu tirar a mão, me __________ pelas costas; (Êxodo)","verás"
"Mas ninguém __________, nem apareça homem algum em todo o monte; (Êxodo)","suba contigo"
"Então Moisés __________ duas tábuas de pedra, como as primeiras; (Êxodo)","lavrou"
"O Senhor __________ numa nuvem e, pondo-se ali junto a ele, proclamou o nome Jeová. (Êxodo)","desceu"
"Então Moisés __________ a inclinar-se à terra, e adorou, dizendo: Senhor, se agora tenho achado graça aos teus olhos, vá o Senhor no meio de nós; (Êxodo)","se apressou"
"Mas __________, e as suas colunas quebrareis, e os seus aserins cortareis (porque não adorarás a nenhum outro deus; (Êxodo)","os seus altares derrubareis"
"Três vezes no ano todos os teus varões __________ perante o Senhor Jeová, Deus do Israel; (Êxodo)","aparecerão"
"Não sacrificarás o sangue do meu sacrifício com pão levedado, nem o sacrifício da festa da páscoa __________ da noite para a manhã. (Êxodo)","ficará"
"Quando Moisés desceu do monte Sinai, trazendo nas mãos as duas tábuas do testemunho, sim, quando desceu do monte, Moisés __________ que a pele do seu rosto resplandecia, por haver Deus falado com ele. (Êxodo)","não sabia"
"Quando, pois, Arão e todos os filhos de Israel __________ para Moisés, eis que a pele do seu rosto resplandecia, pelo que tiveram medo de aproximar-se dele. (Êxodo)","olharam"
"Então Moisés os __________, e Arão e todos os príncipes da congregação tornaram a ele; (Êxodo)","chamou"
"Mas, entrando Moisés perante o Senhor, para falar com ele, tirava o véu até sair; e saindo, __________ aos filhos de Israel o que lhe era ordenado. (Êxodo)","dizia"
"Assim, pois, __________ os filhos de Israel o rosto de Moisés, e que a pele do seu rosto resplandecia; e tornava Moisés a pôr o véu sobre o seu rosto, até entrar para falar com Deus. (Êxodo)","viam"
"Estas são __________ que o Senhor ordenou que cumprísseis. (Êxodo)","as palavras"
"Seis dias __________, mas o sétimo dia vos será santo, sábado de descanso solene ao Senhor; (Êxodo)","se trabalhará"
"Então toda a congregação dos filhos de Israel __________ da presença de Moisés. (Êxodo)","saiu"
"E __________ todo homem cujo coração o moveu, e todo aquele cujo espírito o estimulava, e trouxeram a oferta alçada do Senhor para a obra da tenda da revelação, e para todo o serviço dela, e para as vestes sagradas. (Êxodo)","veio"
"E todo homem que possuía azul, púrpura, carmesim, linho fino, pelos de cabras, peles de carneiros tintas de vermelho, ou peles de golfinhos, __________. (Êxodo)","os trazia"
"E todas as mulheres hábeis fiavam com as mãos, e traziam o que __________, o azul e a púrpura, o carmesim e o linho fino. (Êxodo)","tinham fiado"
"E todas as __________ que quisessem fiavam os pelos das cabras. (Êxodo)","mulheres hábeis"
"Os príncipes __________ pedras de berilo e pedras de engaste para o éfode e para o peitoral, e as especiarias e o azeite para a luz, para o óleo da unção e para o incenso aromático. (Êxodo)","traziam"
"Eis que o Senhor __________ por nome a Bezalel, filho de Uri, filho de Hur, da tribo de Judá, e o encheu do espírito de Deus, no tocante à sabedoria, ao entendimento, à ciência e a todo ofício, para inventar obras artísticas, para trabalhar em ouro, em prata e em bronze, em lavramento de pedras para engastar, em entalhadura de madeira, enfim, para trabalhar em toda obra fina. (Êxodo)","chamou"
"Também lhe __________ o coração para ensinar a outros; (Êxodo)","dispôs"
"Então Moisés __________ a Bezalel e a Aoliabe, e a todo homem hábil, em cujo coração Deus tinha posto sabedoria, isto é, a todo aquele cujo coração o moveu a se chegar à obra para fazê-la; e receberam de Moisés toda a oferta alçada, que os filhos de Israel tinham do para a obra do serviço do santuário, para fazê-la; (Êxodo)","chamou"
"O povo __________ muito mais do que é necessário para o serviço da obra que o Senhor ordenou se fizesse. (Êxodo)","traz"
"Porque __________ que tinham era bastante para toda a obra, e ainda sobejava. (Êxodo)","o material"
"Assim todos os homens hábeis, __________ os que trabalhavam na obra, fizeram o tabernáculo de dez cortinas de linho fino torcido, de azul, de púrpura e de carmesim, com querubins, obra de artífice. (Êxodo)","dentre"
"O comprimento de cada cortina era de vinte e oito __________, e a largura de quatro côvados; (Êxodo)","côvados"
"Cinqüenta laçadas __________ na orla de uma cortina, e cinqüenta laçadas na orla da outra, do segundo grupo; (Êxodo)","fizeram"
"O comprimento de cada cortina era de __________, e a largura de quatro côvados; (Êxodo)","trinta côvados"
"Fizeram __________ colchetes de bronze, para ajuntar a tenda, para que viesse a ser um todo. (Êxodo)","também cinqüenta"
"O comprimento de cada tábua era de __________, e a largura de um côvado e meio. (Êxodo)","dez côvados"
"Cada tábua __________ duas couceiras, unidas uma à outra; (Êxodo)","tinha"
"Assim, pois, __________ as tábuas para o tabernáculo; vinte tábuas para o lado que dá para o sul; (Êxodo)","fizeram"
"Também para o segundo lado do tabernáculo, o que dá para o norte, __________ vinte tábuas, com as suas quarenta bases de prata, duas bases debaixo de uma tábua, e duas bases debaixo de outra. (Êxodo)","fizeram"
"Para o lado posterior do tabernáculo, o que dá para o ocidente, __________ seis tábuas. (Êxodo)","fizeram"
"E para os dois cantos do tabernáculo no lado posterior, __________ mais duas tábuas. (Êxodo)","fizeram"
"Por baixo eram __________, do mesmo modo se estendendo até a primeira argola, em cima; (Êxodo)","duplas"
"Fizeram que o travessão do __________ ao meio das tábuas duma extremidade até a outra. (Êxodo)","meio passasse"
"E __________ as tábuas de ouro, e de ouro fizeram as suas argolas como lugares para os travessões; (Êxodo)","cobriram"
"Fizeram então o véu de azul, púrpura, carmesim e linho fino torcido; com querubins, obra de artífice, o __________. (Êxodo)","fizeram"
"E __________ quatro colunas de madeira de acácia e as cobriram de ouro; (Êxodo)","fizeram-lhe"
"E os querubins __________ as suas asas por cima do propiciatório, cobrindo-o com as asas, tendo as faces voltadas um para o outro; (Êxodo)","estendiam"
"Dos seus lados __________ seis braços: três de um lado do candelabro e três do outro lado. (Êxodo)","saíam"
"Em um braço __________ três copos a modo de flores de amêndoa, com cálice e corola; (Êxodo)","havia"
"Mas na __________ havia quatro copos a modo de flores de amêndoa, com os seus cálices e as suas corolas; (Êxodo)","haste central"
"Os seus cálices e os seus braços __________ uma só peça com a haste; (Êxodo)","formavam"
"E __________ quatro argolas para as quatro extremidades do crivo de bronze, como lugares dos varais. (Êxodo)","fundiu"
"E __________ os varais pelas argolas aos lados do altar, para com eles se levar o altar; fê-lo oco, de tábuas. (Êxodo)","meteu"
"Para o lado meridional as cortinas eram de __________, de cem côvados de comprimento. (Êxodo)","linho fino torcido"
"As suas colunas eram __________, e vinte as suas bases, todas de bronze; (Êxodo)","vinte"
"Para o lado setentrional as cortinas eram de __________; as suas colunas eram vinte, e vinte as suas bases, todas de bronze; os colchetes das colunas e as suas faixas eram de prata. (Êxodo)","cem côvados"
"Para o lado ocidental as cortinas eram de __________ côvados; (Êxodo)","cinqüenta"
"E para o lado oriental eram __________ de cinqüenta côvados. (Êxodo)","as cortinas"
"As cortinas para um lado da porta eram de __________; (Êxodo)","quinze côvados"
"Todas as cortinas do átrio ao redor eram de __________ torcido. (Êxodo)","linho fino"
"O reposteiro da porta do átrio era de __________, púrpura, carmesim e linho fino torcido, obra de bordador; (Êxodo)","azul"
"As suas colunas eram __________, e quatro as suas bases, todas de bronze; (Êxodo)","quatro"
"E todas as estacas do tabernáculo e do átrio ao redor eram de __________. (Êxodo)","bronze"
"Esta é __________ das coisas para o tabernáculo, a saber, o tabernáculo do testemunho, que por ordem de Moisés foram contadas para o ministério dos levitas, por intermédio de Itamar, filho de Arão, o sacerdote. (Êxodo)","a enumeração"
"Todo o ouro gasto na __________, em toda a obra do santuário, a saber, o ouro da oferta, foi vinte e nove talentos e setecentos e trinta siclos, conforme o siclo do santuário. (Êxodo)","obra"
"A prata dos arrolados da congregação __________ em cem talentos e mil setecentos setenta e cinco siclos, conforme o siclo do santuário; (Êxodo)","montou"
"E __________ cem talentos de prata para fundir as bases do santuário e as bases do véu; (Êxodo)","houve"
"E o bronze da oferta foi __________ e dois mil e quatrocentos siclos. (Êxodo)","setenta talentos"
"E o cinto da obra esmerada do éfode, que estava sobre ele, __________ com ele uma só peça e era de obra semelhante, de ouro, azul, púrpura, carmesim e linho fino torcido, como o Senhor ordenara a Moisés. (Êxodo)","formava"
"E __________ as duas cadeiazinhas de trança de ouro nas duas argolas, nas extremidades do peitoral. (Êxodo)","meteram"
"E as outras duas pontas das duas cadeiazinhas de trança __________ nos dois engastes, e as puseram sobre as ombreiras do éfode, na parte dianteira dele. (Êxodo)","meteram"
"E __________ o peitoral, pelas suas argolas, às argolas do éfode por meio de um cordão azul, para que estivesse sobre o cinto de obra esmerada do éfode, e o peitoral não se separasse do éfode, como o Senhor ordenara a Moisés. (Êxodo)","ligaram"
"Nas abas do manto __________ romãs de azul, púrpura e carmesim, de fio torcido. (Êxodo)","fizeram"
"E a ela __________ um cordão azul, para prendê-la à parte superior da mitra, como o Senhor ordenara a Moisés. (Êxodo)","ataram"
"Assim se __________ toda a obra do tabernáculo da tenda da revelação; e os filhos de Israel fizeram conforme tudo o que o Senhor ordenara a Moisés; (Êxodo)","acabou"
"Conforme tudo o que o Senhor ordenara a Moisés, __________ os filhos de Israel toda a obra. (Êxodo)","assim fizeram"
"No __________, no primeiro dia do mês, levantarás o tabernáculo da tenda da revelação, e porás nele a arca do testemunho, e resguardaras a arca com o véu. (Êxodo)","primeiro mês"
"E porás o __________ de ouro para o incenso diante da arca do testemunho; (Êxodo)","altar"
"E porás o __________ do holocausto diante da porta do tabernáculo da tenda da revelação. (Êxodo)","altar"
"E __________ a pia entre a tenda da revelação e o altar, e nela deitarás água. (Êxodo)","porás"
"Ungirás também o __________ do holocausto, e todos os seus utensílios, e santificarás o altar; (Êxodo)","altar"
"E __________ chegar Arão e seus filhos à porta da tenda da revelação, e os lavarás com água. (Êxodo)","farás"
"E __________ Arão das vestes sagradas, e o ungirás, e o santificarás, para que me administre o sacerdócio. (Êxodo)","vestirás"
"E no primeiro mês do segundo ano, no primeiro dia do mês, o tabernáculo foi __________. (Êxodo)","levantado"
"Pôs também a mesa na __________ da revelação, ao lado do tabernáculo para o norte, fora do véu, e sobre ela pôs em ordem o pão perante o Senhor, como o Senhor lhe ordenara. (Êxodo)","tenda"
"Pôs também na __________ da revelação o candelabro defronte da mesa, ao lado do tabernáculo para o sul, e acendeu as lâmpadas perante o Senhor, como o Senhor lhe ordenara. (Êxodo)","tenda"
"Pôs o __________ de ouro na tenda da revelação diante do véu, e sobre ele queimou o incenso de especiarias aromáticas, como o Senhor lhe ordenara. (Êxodo)","altar"
"Depois: __________ a pia entre a tenda da revelação e o altar, e nela deitou água para a as abluções. (Êxodo)","colocou"
"E junto dela Moisés, e Arão e seus filhos __________ as mãos e os pés. (Êxodo)","lavaram"
"Quando entravam na tenda da revelação, e quando chegavam ao altar, __________, como o Senhor ordenara a Moisés. (Êxodo)","lavavam-se"
"Então a __________ cobriu a tenda da revelação, e a glória do Senhor encheu o tabernáculo; (Êxodo)","nuvem"
"Quando, pois, a nuvem se levantava de sobre o tabernáculo, __________ os filhos de Israel, em todas as suas jornadas; (Êxodo)","prosseguiam"
"Porquanto a __________ do Senhor estava de dia sobre o tabernáculo, e o fogo estava de noite sobre ele, perante os olhos de toda a casa de Israel, em todas as suas jornadas. (Êxodo)","nuvem"
"A terra era sem __________ e vazia; e havia trevas sobre a face do abismo, mas o Espírito de Deus pairava sobre a face das águas. (Gênesis)","forma"
"Ajuntem-se num __________ as águas que estão debaixo do céu, e apareça o elemento seco. (Gênesis)","só lugar"
"Produza a terra __________, ervas que dêem semente, e árvores frutíferas que, segundo as suas espécies, dêem fruto que tenha em si a sua semente, sobre a terra. (Gênesis)","relva"
"A terra, pois, __________ relva, ervas que davam semente segundo as suas espécies, e árvores que davam fruto que tinha em si a sua semente, segundo as suas espécies. (Gênesis)","produziu"
"Eis que vos __________ todas as ervas que produzem semente, as quais se acham sobre a face de toda a terra, bem como todas as árvores em que há fruto que dê semente; (Gênesis)","tenho dado"
"E a todos os animais da terra, a todas as aves do céu e a todo ser vivente que se arrasta sobre a terra, __________ todas as ervas verdes como mantimento. (Gênesis)","tenho dado"
"Assim foram __________ os céus e a terra, com todo o seu exército. (Gênesis)","acabados"
"Ora, havendo Deus completado no dia sétimo a obra que tinha feito, __________ nesse dia de toda a obra que fizera. (Gênesis)","descansou"
"Eis __________ dos céus e da terra, quando foram criados. (Gênesis)","as origens"
"No dia em que o Senhor Deus fez a terra e os céus não havia ainda nenhuma planta do campo na terra, pois nenhuma erva do campo __________ ainda brotado; (Gênesis)","tinha"
"Um __________, porém, subia da terra, e regava toda a face da terra. (Gênesis)","vapor"
"E __________ o Senhor Deus o homem do pó da terra, e soprou-lhe nas narinas o fôlego da vida; e o homem tornou-se alma vivente. (Gênesis)","formou"
"O nome do primeiro é __________: este é o que rodeia toda a terra de Havilá, onde há ouro; e o ouro dessa terra é bom: ali há o bdélio, e a pedra de berilo. (Gênesis)","Pisom"
"Não é bom que o homem esteja só; far-lhe-ei __________ que lhe seja idônea. (Gênesis)","uma ajudadora"
"Da terra __________, pois, o Senhor Deus todos os animais o campo e todas as aves do céu, e os trouxe ao homem, para ver como lhes chamaria; (Gênesis)","formou"
"Esta é __________ dos meus ossos, e carne da minha carne; (Gênesis)","agora osso"
"Ora, a serpente era __________ de todos os animais do campo, que o Senhor Deus tinha feito. (Gênesis)","o mais astuto"
"Porque Deus __________ que no dia em que comerdes desse fruto, vossos olhos se abrirão, e sereis como Deus, conhecendo o bem e o mal. (Gênesis)","sabe"
"Então, vendo a mulher que aquela árvore era boa para se comer, e agradável aos olhos, e árvore desejável para dar entendimento, __________ do seu fruto, comeu, e deu a seu marido, e ele também comeu. (Gênesis)","tomou"
"Então foram __________ os olhos de ambos, e conheceram que estavam nus; (Gênesis)","abertos"
"E, ouvindo a voz do Senhor Deus, que passeava no jardim à tardinha, __________ o homem e sua mulher da presença do Senhor Deus, entre as árvores do jardim. (Gênesis)","esconderam-se"
"Comeste da árvore de que te ordenei que __________? (Gênesis)","não comesses"
"Porquanto __________ isso, maldita serás tu dentre todos os animais domésticos, e dentre todos os animais do campo; (Gênesis)","fizeste"
"E à mulher __________: Multiplicarei grandemente a dor da tua conceição; em dor darás à luz filhos; e o teu desejo será para o teu marido, e ele te dominará. (Gênesis)","disse"
"Eis que o homem __________ como um de nós, conhecendo o bem e o mal. (Gênesis)","se tem tornado"
"Ora, __________ que estenda a sua mão, e tome também da árvore da vida, e coma e viva eternamente. (Gênesis)","não suceda"
"O Senhor Deus, pois, __________ do jardim do Éden para lavrar a terra, de que fora tomado. (Gênesis)","o lançou fora"
"Abel foi __________ de ovelhas, e Caim foi lavrador da terra. (Gênesis)","pastor"
"Ao cabo de dias __________ Caim do fruto da terra uma oferta ao Senhor. (Gênesis)","trouxe"
"Abel __________ dos primogênitos das suas ovelhas, e da sua gordura. (Gênesis)","também trouxe"
"Ora, __________ o Senhor para Abel e para a sua oferta, mas para Caim e para a sua oferta não atentou. (Gênesis)","atentou"
"E, estando eles no campo, Caim __________ contra o seu irmão Abel, e o matou. (Gênesis)","se levantou"
"A voz do sangue de teu irmão __________ a mim desde a terra. (Gênesis)","está clamando"
"Quando lavrares a terra, não te __________ a sua força; fugitivo e vagabundo serás na terra. (Gênesis)","dará mais"
"É __________ a minha punição do que a que eu possa suportar. (Gênesis)","maior"
"Portanto quem matar a Caim, sete vezes sobre ele __________ a vingança. (Gênesis)","cairá"
"Caim __________ uma cidade, e lhe deu o nome do filho, Enoque. (Gênesis)","edificou"
"A Enoque __________ Irade, e Irade gerou a Meujael, e Meujael gerou a Metusael, e Metusael gerou a Lameque. (Gênesis)","nasceu"
"A Zila __________ um filho, Tubal-Caim, fabricante de todo instrumento cortante de cobre e de ferro; (Gênesis)","também nasceu"
"Disse Lameque a suas mulheres: Ada e Zila, __________ a minha voz; escutai, mulheres de Lameque, as minhas palavras; (Gênesis)","ouvi"
"A Sete __________ um filho, a quem pôs o nome de Enos. (Gênesis)","também nasceu"
"Foi nesse tempo, que os homens começaram a __________ o nome do Senhor. (Gênesis)","invocar"
"Homem e mulher os __________; e os abençoou, e os chamou pelo nome de homem, no dia em que foram criados. (Gênesis)","criou"
"Adão __________ cento e trinta anos, e gerou um filho à sua semelhança, conforme a sua imagem, e pôs-lhe o nome de Sete. (Gênesis)","viveu"
"E foram __________ de Adão, depois que gerou a Sete, oitocentos anos; e gerou filhos e filhas. (Gênesis)","os dias"
"Todos os dias que Adão viveu foram __________ e trinta anos; e morreu. (Gênesis)","novecentos"
"Todos os dias de Sete foram __________ e doze anos; e morreu. (Gênesis)","novecentos"
"Todos os dias de Enos foram __________ e cinco anos; e morreu. (Gênesis)","novecentos"
"Todos os dias de Quenã foram __________ e dez anos; e morreu. (Gênesis)","novecentos"
"Maalalel __________ sessenta e cinco anos, e gerou a Jarede. (Gênesis)","viveu"
"Viveu Maalalel, depois que __________ a Jarede, oitocentos e trinta anos; e gerou filhos e filhas. (Gênesis)","gerou"
"Todos os dias de Maalalel foram __________ e noventa e cinco anos; e morreu. (Gênesis)","oitocentos"
"Jarede __________ cento e sessenta e dois anos, e gerou a Enoque. (Gênesis)","viveu"
"Todos os dias de Jarede foram __________ e sessenta e dois anos; e morreu. (Gênesis)","novecentos"
"Enoque __________ sessenta e cinco anos, e gerou a Matusalém. (Gênesis)","viveu"
"Todos os dias de Enoque foram __________ e sessenta e cinco anos; (Gênesis)","trezentos"
"Matusalém __________ cento e oitenta e sete anos, e gerou a Lameque. (Gênesis)","viveu"
"Viveu Matusalém, depois que __________ a Lameque, setecentos e oitenta e dois anos; e gerou filhos e filhas. (Gênesis)","gerou"
"Todos os dias de Matusalém foram __________ e sessenta e nove anos; e morreu. (Gênesis)","novecentos"
"Este nos __________ de nossas obras e do trabalho de nossas mãos, os quais provêm da terra que o Senhor amaldiçoou. (Gênesis)","consolará acerca"
"Todos os dias de Lameque foram __________ e setenta e sete anos; e morreu. (Gênesis)","setecentos"
"Sucedeu que, quando os homens começaram a multiplicar-se sobre a terra, e lhes nasceram filhas, __________ os filhos de Deus que as filhas dos homens eram formosas; e tomaram para si mulheres de todas as que escolheram. (Gênesis)","viram"
"O meu Espírito __________ para sempre no homem, porquanto ele é carne, mas os seus dias serão cento e vinte anos. (Gênesis)","não permanecerá"
"Naqueles dias estavam os nefilins na terra, e também depois, quando os filhos de Deus conheceram as filhas dos homens, as quais lhes __________ filhos. (Gênesis)","deram"
"Esses nefilins eram __________, os homens de renome, que houve na antigüidade. (Gênesis)","os valentes"
"Era __________ e perfeito em suas gerações, e andava com Deus. (Gênesis)","homem justo"
"A terra, porém, estava __________ de Deus, e cheia de violência. (Gênesis)","corrompida diante"
"Porque eis que eu __________ o dilúvio sobre a terra, para destruir, de debaixo do céu, toda a carne em que há espírito de vida; (Gênesis)","trago"
"Das __________ segundo as suas espécies, do gado segundo as suas espécies, de todo réptil da terra segundo as suas espécies, dois de cada espécie virão a ti, para os conservares em vida. (Gênesis)","aves"
"Entra na arca, tu e toda a tua casa, porque tenho visto que és __________ de mim nesta geração. (Gênesis)","justo diante"
"De todos os animais limpos __________ contigo sete e sete, o macho e sua fêmea; (Gênesis)","levarás"
"Porque, passados ainda sete dias, __________ chover sobre a terra quarenta dias e quarenta noites, e exterminarei da face da terra todas as criaturas que fiz. (Gênesis)","farei"
"Noé __________ na arca com seus filhos, sua mulher e as mulheres de seus filhos, por causa das águas do dilúvio. (Gênesis)","entrou"
"Dos animais limpos e dos que não são limpos, das aves, e de todo réptil sobre a terra, __________ dois a dois para junto de Noé na arca, macho e fêmea, como Deus ordenara a Noé. (Gênesis)","entraram"
"Passados os sete dias, __________ sobre a terra as águas do dilúvio. (Gênesis)","vieram"
