"Igualmente, quanto à mulher mais mimosa e delicada no meio de ti, que de mimo e delicadeza nunca tentou pôr a planta de seu pé sobre a terra, será __________ o seu olho para com o homem de seu regaço, para com seu filho, e para com sua filha; (Deuteronômio)","mesquinho"
"Se __________ cuidado de guardar todas as palavras desta lei, que estão escritas neste livro, para temeres este nome glorioso e temível, o Senhor teu Deus; (Deuteronômio)","não tiveres"
"Também o Senhor __________ vir a ti toda enfermidade, e toda praga que não está escrita no livro desta lei, até que sejas destruído. (Deuteronômio)","fará"
"Assim ficareis __________ em número, depois de haverdes sido em multidão como as estrelas do céu; (Deuteronômio)","poucos"
"E __________ que, assim como o Senhor se deleitava em vós, para fazer-vos o bem e multiplicar-vos, assim o Senhor se deleitará em destruir-vos e consumir-vos; (Deuteronômio)","será"
"E o Senhor vos __________ entre todos os povos desde uma extremidade da terra até a outra; e ali servireis a outros deuses que não conhecestes, nem vós nem vossos pais, deuses de pau e de pedra. (Deuteronômio)","espalhará"
"E nem ainda entre estas nações descansarás, nem a planta de teu pé __________ repouso; (Deuteronômio)","terá"
"E a tua vida estará __________ em suspenso diante de ti; (Deuteronômio)","como"
"Ali vos __________ a venda como escravos e escravas aos vossos inimigos, mas não haverá quem vos compre. (Deuteronômio)","poreis"
"Mas até hoje o Senhor não vos tem __________ um coração para entender, nem olhos para ver, nem ouvidos para ouvir. (Deuteronômio)","dado"
"Quando, pois, viemos a este lugar, Siom, rei de Hesbom, e __________, rei de Basã, nos saíram ao encontro, à peleja, e nós os ferimos; (Deuteronômio)","Ogue"
", a saber, todos os homens de Israel, os vossos pequeninos, as vossas mulheres, e o estrangeiro que está no __________ do vosso arraial, tanto o rachador da vossa lenha como o tirador da vossa água; (Deuteronômio)","meio"
"Ora, não é somente convosco que faço este pacto e este juramento, mas é com aquele que hoje está aqui conosco perante o Senhor nosso Deus, e também com aquele que hoje não está aqui conosco (porque vós sabeis como habitamos na __________ do Egito, e como passamos pelo meio das nações, pelas quais passastes; (Deuteronômio)","terra"
"O Senhor não lhe __________ perdoar, pelo contrário fumegará contra esse homem a ira do Senhor, e o seu zelo, e toda maldição escrita neste livro pousará sobre ele, e o Senhor lhe apagará o nome de debaixo do céu. (Deuteronômio)","quererá"
"Assim o Senhor o __________ para mal, dentre todas as tribos de Israel, conforme todas as maldições do pacto escrito no livro desta lei. (Deuteronômio)","separará"
"As coisas encobertas __________ ao Senhor nosso Deus, mas as reveladas nos pertencem a nós e a nossos filhos para sempre, para que observemos todas as palavras desta lei. (Deuteronômio)","pertencem"
"Quando te sobrevierem todas estas coisas, a bênção ou a maldição, que pus diante de ti, e te __________ delas entre todas as nações para onde o Senhor teu Deus te houver lançado, e te converteres ao Senhor teu Deus, e obedeceres à sua voz conforme tudo o que eu te ordeno hoje, tu e teus filhos, de todo o teu coração e de toda a tua alma, o Senhor teu Deus te fará voltar do teu cativeiro, e se compadecerá de ti, e tornará a ajuntar-te dentre todos os povos entre os quais te houver espalhado o senhor teu Deus. (Deuteronômio)","recordares"
"Ainda que o teu desterro tenha sido para a extremidade do céu, desde ali te __________ o Senhor teu Deus, e dali te tomará; (Deuteronômio)","ajuntará"
"Também o Senhor teu Deus __________ o teu coração, e o coração de tua descendência, a fim de que ames ao Senhor teu Deus de todo o teu coração e de toda a tua alma, para que vivas. (Deuteronômio)","circuncidará"
"E o Senhor teu Deus __________ todas estas maldições sobre os teus inimigos, sobre aqueles que te tiverem odiado e perseguido. (Deuteronômio)","porá"
"Então o Senhor teu Deus te __________ prosperar grandemente em todas as obras das tuas mãos, no fruto do teu ventre, e no fruto dos teus animais, e no fruto do teu solo; (Deuteronômio)","fará"
"Porque este mandamento, que eu hoje te ordeno, não te é difícil demais, nem tampouco está __________ de ti. (Deuteronômio)","longe"
"Nem está além do mar, para dizeres: __________ passará por nós além do mar, e no-lo trará, e no-lo fará ouvir, para que o cumpramos? (Deuteronômio)","Quem"
"Mas __________ está mui perto de ti, na tua boca, e no teu coração, para a cumprires. (Deuteronômio)","a palavra"
"Se guardares o mandamento que eu hoje te ordeno de amar ao Senhor teu Deus, de andar nos seus caminhos, e de guardar os seus mandamentos, os seus estatutos e os seus preceitos, então viverás, e te multiplicarás, e o Senhor teu Deus te __________ na terra em que estás entrando para a possuíres. (Deuteronômio)","abençoará"
"Mas se o teu coração se desviar, e não quiseres __________, e fores seduzido para adorares outros deuses, e os servires, declaro-te hoje que certamente perecerás; (Deuteronômio)","ouvir"
"E o Senhor __________ fará como fez a Siom e a Ogue, reis dos amorreus, e à sua terra, aos quais destruiu. (Deuteronômio)","lhes"
"Quando, pois, o Senhor vo-los entregar, __________ com eles conforme todo o mandamento que vos tenho ordenado. (Deuteronômio)","fareis"
"Sê __________ e corajoso, porque tu entrarás com este povo na terra que o Senhor, com juramento, prometeu a teus pais lhes daria; (Deuteronômio)","forte"
"O Senhor, pois, é __________ que vai adiante de ti; (Deuteronômio)","aquele"
"Ao fim de cada sete anos, no tempo determinado do ano da remissão, na festa dos __________, quando todo o Israel vier a comparecer perante ao Senhor teu Deus, no lugar que ele escolher, lereis esta lei diante de todo o Israel, para todos ouvirem. (Deuteronômio)","tabernáculos"
"Assim foram __________ e Josué, e se apresentaram na tenda da revelação. (Deuteronômio)","Moisés"
"Então o Senhor __________ na tenda, na coluna de nuvem; (Deuteronômio)","apareceu"
"Não é, __________, por não estar o meu Deus comigo, que me sobrevieram estes males? (Deuteronômio)","porventura"
"Agora, pois, escrevei para vós este cântico, e ensinai-o aos filhos de Israel; __________ na sua boca, para que este cântico me sirva por testemunha contra o povo de Israel. (Deuteronômio)","ponde-o"
"Porque o introduzirei na terra que, com juramento, __________ a seus pais, terra que mana leite e mel; (Deuteronômio)","prometi"
"E __________ que, quando lhe sobrevierem muitos males e angústias, então este cântico responderá contra ele por testemunha, pois não será esquecido da boca de sua descendência; porquanto conheço a sua imaginação, o que ele maquina hoje, antes de eu o ter introduzido na terra que lhe prometi com juramento. (Deuteronômio)","será"
"Assim Moisés __________ este cântico naquele dia, e o ensinou aos filhos de Israel. (Deuteronômio)","escreveu"
"Porque __________ a vossa rebeldia e a vossa dura cerviz; (Deuteronômio)","conheço"
"Porque __________ o nome do Senhor; engrandecei o nosso Deus. (Deuteronômio)","proclamarei"
"É __________ que recompensas ao Senhor, povo louco e insensato? (Deuteronômio)","assim"
"Quando o Altíssimo dava às nações a sua herança, quando separava os filhos dos __________, estabeleceu os termos dos povos conforme o número dos filhos de Israel. (Deuteronômio)","homens"
"Porque a porção do Senhor é o seu povo; __________ é a parte da sua herança. (Deuteronômio)","Jacó"
"Como a águia desperta o seu ninho, adeja sobre os seus filhos e, estendendo as suas asas, __________, e os leva sobre as suas asas, assim só o Senhor o guiou, e não havia com ele deus estranho. (Deuteronômio)","toma-os"
"E __________, engordando, recalcitrou (tu engordaste, tu te engrossaste e te cevaste); (Deuteronômio)","Jesurum"
"A zelos me __________ cem aquilo que não é Deus, com as suas vaidades me provocaram à ira; (Deuteronômio)","provocaram"
"Porque __________ se acendeu na minha ira, e arde até o mais profundo do Seol, e devora a terra com o seu fruto, e abrasa os fundamentos dos montes. (Deuteronômio)","um fogo"
"Por __________ a espada, e por dentro o pavor, tanto ao mancebo como à virgem, assim à criança de peito como ao homem encanecido. (Deuteronômio)","fora devastará"
"Porque são __________ falta de conselhos, e neles não há entendimento. (Deuteronômio)","gente"
"Se __________ fossem sábios, entenderiam isso, e atentariam para o seu fim! (Deuteronômio)","eles"
"Como poderia um só perseguir mil, e __________ fazer rugir dez mil, se a sua Rocha não os vendera, e o Senhor não os entregara? (Deuteronômio)","dois"
"Porque __________ não é como a nossa Rocha, sendo até os nossos inimigos juízes disso. (Deuteronômio)","a sua rocha"
"Porque a sua vinha é da __________ de Sodoma e dos campos de Gomorra; (Deuteronômio)","vinha"
"O seu vinho é __________ de serpentes, e peçonha cruel de víboras. (Deuteronômio)","veneno"
"Porque o Senhor __________ ao seu povo, e se arrependerá no tocante aos seus servos, quando vir que o poder deles já se foi, e que não resta nem escravo nem livre. (Deuteronômio)","vindicará"
"Como eu vivo para sempre, se eu __________ a minha espada reluzente, e a minha mão travar do juízo, então retribuirei vingança aos meus adversários, e recompensarei aos que me odeiam. (Deuteronômio)","afiar"
"De sangue __________ as minhas setas, e a minha espada devorará carne; (Deuteronômio)","embriagarei"
"O Senhor __________ do Sinai, e de Seir raiou sobre nós; (Deuteronômio)","veio"
"E __________ rei em Jesurum, quando se congregaram os cabeças do povo juntamente com as tribos de Israel. (Deuteronômio)","tornou-se"
"Abençoa o seu poder, ó Senhor, e aceita a obra das suas mãos; __________ os lombos dos que se levantam contra ele e o odeiam, para que nunca mais se levantem. (Deuteronômio)","fere"
"Abençoada pelo __________ seja a sua terra, com os mais excelentes dons do céu, com o orvalho, e com as águas do abismo que jaz abaixo; (Deuteronômio)","Senhor"
"Eis __________ primogênito; ele tem majestade; e os seus chifres são chifres de boi selvagem; (Deuteronômio)","o seu novilho"
"De Zebulom __________: Zebulom, alegra-te nas tuas saídas; (Deuteronômio)","disse"
"Ele se proveu da primeira parte, __________ ali estava reservada a porção do legislador; (Deuteronômio)","porquanto"
"Bendito seja __________ dentre os filhos de Israel; (Deuteronômio)","Aser"
"Assim Moisés, servo do Senhor, morreu ali na terra de Moabe, conforme o dito do Senhor, que o __________ no vale, na terra de Moabe, defronte de Bete-Peor; (Deuteronômio)","sepultou"
"Os filhos de Israel __________ a Moisés por trinta dias nas planícies de Moabe; (Deuteronômio)","prantearam"
"Todas as almas, pois, que procederam da coxa de Jacó, foram __________; José, porém, já estava no Egito. (Êxodo)","setenta"
"Depois os filhos de Israel __________ e aumentaram muito, multiplicaram-se e tornaram-se sobremaneira fortes, de modo que a terra se encheu deles. (Êxodo)","frutificaram"
"Eis que __________ de Israel é mais numeroso e mais forte do que nos. (Êxodo)","o povo"
"Eia, __________ de astúcia para com ele, para que não se multiplique, e aconteça que, vindo guerra, ele também se ajunte com os nossos inimigos, e peleje contra nós e se retire da terra. (Êxodo)","usemos"
"Assim os israelitas __________ para Faraó cidades armazéns, Pitom e Ramessés. (Êxodo)","edificaram"
"Mas quanto mais os egípcios __________ o povo de Israel, tanto mais este se multiplicava e se espalhava; (Êxodo)","afligiam"
"Por isso os egípcios __________ os filhos de Israel servir com dureza; (Êxodo)","faziam"
"Quando ajudardes no __________ as hebréias, e as virdes sobre os assentos, se for filho, matá-lo-eis; (Êxodo)","parto"
"As parteiras, porém, __________ a Deus e não fizeram como o rei do Egito lhes ordenara, antes conservavam os meninos com vida. (Êxodo)","temeram"
"Por que __________ feito isto e guardado os meninos com vida? (Êxodo)","tendes"
"É que __________ hebréias não são como as egípcias; (Êxodo)","as mulheres"
"Também aconteceu que, como as parteiras temeram a Deus, ele __________ estabeleceu as casas. (Êxodo)","lhes"
"A todos os __________ que nascerem lançareis no rio, mas a todas as filhas guardareis com vida. (Êxodo)","filhos"
"Não podendo, porém, __________ por mais tempo, tomou para ele uma arca de juncos, e a revestiu de betume e pez; (Êxodo)","escondê-lo"
"E sua irmã __________ de longe, para saber o que lhe aconteceria. (Êxodo)","postou-se"
"A filha de Faraó __________ para banhar-se no rio, e as suas criadas passeavam à beira do rio. (Êxodo)","desceu"
"Vendo ela a arca no meio os juncos, __________ a sua criada buscá-la. (Êxodo)","mandou"
"Quando, pois, o menino era já grande, ela o __________ à filha de Faraó, a qual o adotou; (Êxodo)","trouxe"
"Ora, __________ naqueles dias que, sendo Moisés já homem, saiu a ter com seus irmãos e atentou para as suas cargas; e viu um egípcio que feria a um hebreu dentre, seus irmãos. (Êxodo)","aconteceu"
"E quando __________ soube disso, procurou matar a Moisés. (Êxodo)","Faraó"
"O sacerdote de Midiã __________ sete filhas, as quais vieram tirar água, e encheram os tanques para dar de beber ao rebanho de seu pai. (Êxodo)","tinha"
"Então __________ concordou em morar com aquele homem, o qual lhe deu sua filha Zípora. (Êxodo)","Moisés"
"No __________ de muitos dias, morreu o rei do Egito; (Êxodo)","decorrer"
"Ora, __________ estava apascentando o rebanho de Jetro, seu sogro, sacerdote de Midiã; (Êxodo)","Moisés"
"E __________ o anjo do Senhor em uma chama de fogo do meio duma sarça. (Êxodo)","apareceu-lhe"
"Agora me __________ para lá e verei esta maravilha, e por que a sarça não se queima. (Êxodo)","virarei"
"E vendo o Senhor que ele se virara para ver, __________ do meio da sarça, e disse: Moisés, Moisés! (Êxodo)","chamou-o"
"Eu sou __________ de teu pai, o Deus de Abraão, o Deus de Isaque, e o Deus de Jacó. (Êxodo)","o Deus"
"E __________ escondeu o rosto, porque temeu olhar para Deus. (Êxodo)","Moisés"
"Com efeito tenho __________ a aflição do meu povo, que está no Egito, e tenho ouvido o seu clamor por causa dos seus exatores, porque conheço os seus sofrimentos; e desci para o livrar da mão dos egípcios, e para o fazer subir daquela terra para uma terra boa e espaçosa, para uma terra que mana leite e mel; (Êxodo)","visto"
"E agora, eis que o clamor dos filhos de Israel é __________ a mim; (Êxodo)","vindo"
"Quando houveres tirado do __________ o meu povo, servireis a Deus neste monte. (Êxodo)","Egito"
"O Senhor, o Deus de vossos pais, o Deus de Abraão, o Deus de Isaque, e o Deus de Jacó, me __________ a vós; (Êxodo)","enviou"
"E eu __________ graça a este povo aos olhos dos egípcios; e acontecerá que, quando sairdes, não saireis vazios. (Êxodo)","darei"
"Porque cada mulher __________ à sua vizinha e à sua hóspeda jóias de prata e jóias de ouro, bem como vestidos, os quais poreis sobre vossos filhos e sobre vossas filhas; assim despojareis os egípcios. (Êxodo)","pedirá"
"Ele a __________ no chão, e ela se tornou em cobra; (Êxodo)","lançou"
"Estende a mão e pega-lhe __________ cauda (estendeu ele a mão e lhe pegou, e ela se tornou em vara na sua mão); (Êxodo)","pela"
"E quando a tirou, eis que a mão estava __________, branca como a neve. (Êxodo)","leprosa"
"E __________ que, se eles não te crerem, nem atentarem para o primeiro sinal, crerão ao segundo sinal. (Êxodo)","sucederá"
"E se ainda não crerem a estes dois sinais, nem ouvirem a tua voz, então tomarás da água do rio, e a derramarás sobre a terra seca; e a água que __________ do rio tornar-se-á em sangue sobre a terra seca. (Êxodo)","tomares"
"Ao que lhe __________ o Senhor: Quem faz a boca do homem? (Êxodo)","replicou"
"Ah, Senhor! __________, peço-te, por mão daquele a quem tu hás de enviar. (Êxodo)","envia"
"Eis que ele também te sai ao encontro, e vendo-te, __________ em seu coração. (Êxodo)","se alegrará"
"Ora, __________ no caminho, numa estalagem, que o Senhor o encontrou, e quis matá-lo. (Êxodo)","sucedeu"
"E __________ Moisés a Arão todas as palavras com que o Senhor o enviara e todos os sinais que lhe mandara. (Êxodo)","relatou"
"Então foram __________ e Arão e ajuntaram todos os anciãos dos filhos de Israel; (Êxodo)","Moisés"
"E o povo __________; e quando ouviram que o Senhor havia visitado os filhos de Israel e que tinha visto a sua aflição, inclinaram-se, e adoraram. (Êxodo)","creu"
"Eis que o povo da terra já é __________, e vós os fazeis abandonar as suas cargas. (Êxodo)","muito"
"Também lhes __________ a conta dos tijolos que dantes faziam; nada diminuireis dela; (Êxodo)","imporeis"
"Então o povo se espalhou por toda parte do Egito a __________ restolho em lugar de palha. (Êxodo)","colher"
"Fazei tijolos; e eis que teus servos são __________; (Êxodo)","açoitados"
"Mas ele __________: Estais ociosos, estais ociosos; (Êxodo)","respondeu"
"Então, tornando-se __________ ao Senhor, disse: Senhor! (Êxodo)","Moisés"
"Pois desde que me apresentei a Faraó para falar em teu nome, ele tem __________ a este povo; e de nenhum modo tens livrado o teu povo. (Êxodo)","maltratado"
"Eu vos __________ na terra que jurei dar a Abraão, a Isaque e a Jacó; (Êxodo)","introduzirei"
"Assim falou __________ aos filhos de Israel, mas eles não lhe deram ouvidos, por causa da angústia de espírito e da dura servidão. (Êxodo)","Moisés"
"Todavia o Senhor __________ a Moisés e a Arão, e deu-lhes mandamento para os filhos de Israel, e para Faraó, rei do Egito, a fim de tirarem os filhos de Israel da terra do Egito.. (Êxodo)","falou"
"E __________ são os nomes dos filhos de Levi, segundo as suas gerações: Gérson, Coate e Merári; e os anos da vida de Levi foram cento e trinta e sete anos. (Êxodo)","estes"
"Ora, __________ tomou por mulher a Joquebede, sua tia; (Êxodo)","Anrão"
"Foram __________ os que falaram a Faraó, rei do Egito, a fim de tirarem do Egito os filhos de Israel; este Moisés e este Arão. (Êxodo)","eles"
"Eu sou __________; dize a Faraó, rei do Egito, tudo quanto eu te digo. (Êxodo)","Jeová"
"Eis que te tenho posto como Deus a Faraó, e Arão, __________, será o teu profeta. (Êxodo)","teu irmão"
"Tu __________ tudo o que eu te mandar; e Arão, teu irmão, falará a Faraó, que deixe ir os filhos de Israel da sua terra. (Êxodo)","falarás"
"Eu, porém, __________ o coração de Faraó e multiplicarei na terra do Egito os meus sinais e as minhas maravilhas. (Êxodo)","endurecerei"
"E os egípcios __________ que eu sou o Senhor, quando estender a minha mão sobre o Egito, e tirar os filhos de Israel do meio deles. (Êxodo)","saberão"
"Pois cada um deles __________ a sua vara, e elas se tornaram em serpentes; (Êxodo)","lançou"
"Eis que eu, com esta vara que tenho na mão, __________ as águas que estão no rio, e elas se tornarão em sangue. (Êxodo)","ferirei"
"E os peixes que estão no rio __________, e o rio cheirará mal; (Êxodo)","morrerão"
"De modo que os peixes que estavam no rio __________, e o rio cheirou mal, e os egípcios não podiam beber da água do rio; e houve sangue por toda a terra do Egito. (Êxodo)","morreram"
"Mas __________ fizeram também os magos do Egito com os seus encantamentos; de maneira que o coração de Faraó se endureceu, e não os ouviu, como o Senhor tinha dito. (Êxodo)","o mesmo"
"Todos os __________, pois, cavaram junto ao rio, para achar água que beber; (Êxodo)","egípcios"
"Assim se __________ sete dias, depois que o Senhor ferira o rio. (Êxodo)","passaram"
"Mas se __________ deixá-lo ir, eis que ferirei com rãs todos os teus termos. (Êxodo)","recusares"
"O rio __________ rãs em abundância, que subirão e virão à tua casa, e ao teu dormitório, e sobre a tua cama, e às casas dos teus servos, e sobre o teu povo, e aos teus fornos, e às tuas amassadeiras. (Êxodo)","produzirá"
"Então os magos __________ o mesmo com os seus encantamentos, e fizeram subir rãs sobre a terra do Egito. (Êxodo)","fizeram"
"-te __________ quando é que hei de rogar por ti, e pelos teus servos, e por teu povo, para tirar as rãs de ti, e das tuas casas, de sorte que fiquem somente no rio?. (Êxodo)","dizer-me"
"Seja conforme a tua __________, para que saibas que ninguém há como o Senhor nosso Deus. (Êxodo)","palavra"
"As rãs, pois, se apartarão de ti, e das tuas casas, e dos __________ servos, e do teu povo; (Êxodo)","teus"
"Mas vendo Faraó que havia __________, endureceu o seu coração, e não os ouviu, como o Senhor tinha dito. (Êxodo)","descanso"
"Também __________ fizeram assim com os seus encantamentos para produzirem piolhos, mas não puderam. (Êxodo)","os magos"
"No entanto __________ de Faraó se endureceu, e não os ouvia, como o Senhor tinha dito. (Êxodo)","o coração"
"Mas naquele dia __________ a terra de Gósem em que o meu povo habita, a fim de que nela não haja enxames de moscas, para que saibas que eu sou o Senhor no meio desta terra. (Êxodo)","separarei"
"Não convém que assim se faça, porque é abominação aos egípcios o que havemos de __________ ao Senhor nosso Deus. (Êxodo)","oferecer"
"Sacrificando nós a abominação dos egípcios perante os seus olhos, não nos __________ eles? (Êxodo)","apedrejarão"
"Eis que __________ da tua presença e orarei ao Senhor, que estes enxames de moscas se apartem amanhã de Faraó, dos seus servos, e do seu povo; somente não torne mais Faraó a proceder dolosamente, não deixando ir o povo para oferecer sacrifícios ao Senhor. (Êxodo)","saio"
"Então saiu __________ da presença de Faraó, e orou ao Senhor. (Êxodo)","Moisés"
"Mas __________ Faraó ainda esta vez o seu coração, e não deixou ir o povo. (Êxodo)","endureceu"
"Porque, se recusares deixá-los ir, e ainda os retiveres, eis que a mão do Senhor será sobre teu gado, que está no __________: sobre os cavalos, sobre os jumentos, sobre os camelos, sobre os bois e sobre as ovelhas; (Êxodo)","campo"
"Mas o Senhor __________ distinção entre o gado de Israel e o gado do Egito; (Êxodo)","fará"
"E __________ mandou ver, e eis que do gado dos israelitas não morrera sequer um. (Êxodo)","Faraó"
"Mas __________ de Faraó se obstinou, e não deixou ir o povo. (Êxodo)","o coração"
"E __________ tomaram cinza do forno, e apresentaram-se diante de Faraó; (Êxodo)","eles"
"Os magos não podiam __________ diante de Moisés, por causa dos tumores; (Êxodo)","manter-se"
"Mas o Senhor __________ o coração de Faraó, e este não os ouviu, como o Senhor tinha dito a Moisés. (Êxodo)","endureceu"
"Agora, por pouco, teria eu estendido a mão e ferido a ti e ao teu povo com pestilência, e tu terias sido __________ da terra; (Êxodo)","destruído"
"Tu ainda te __________ contra o meu povo, não o deixando ir? (Êxodo)","exaltas"
"Eis que amanhã, por este tempo, s farei __________ saraiva tão grave qual nunca houve no Egito, desde o dia em que foi fundado até agora. (Êxodo)","chover"
"Agora, pois, __________ o teu gado e tudo o que tens no campo; (Êxodo)","manda recolher"
"E __________ estendeu a sua vara para o céu, e o Senhor enviou trovões e saraiva, e fogo desceu à terra; (Êxodo)","Moisés"
"E a saraiva __________, em toda a terra do Egito, tudo quanto havia no campo, tanto homens como animais; feriu também toda erva do campo, e quebrou todas as árvores do campo. (Êxodo)","feriu"
"Somente na terra de Gósem onde se achavam __________ de Israel, não houve saraiva. (Êxodo)","os filhos"
"Logo que eu tiver saído da cidade __________ minhas mãos ao Senhor; (Êxodo)","estenderei"
"Ora, o linho e a cevada foram __________, porque a cevada já estava na espiga, e o linho em flor; (Êxodo)","danificados"
"Assim, __________ de Faraó se endureceu, e não deixou ir os filhos de Israel, como o Senhor tinha dito por Moisés. (Êxodo)","o coração"
"Seja __________ convosco, se eu vos deixar ir a vós e a vossos pequeninos! (Êxodo)","o Senhor"
"Quanto aos gafanhotos, __________ a tua mão sobre a terra do Egito, para que venham eles sobre a terra do Egito e comam toda erva da terra, tudo o que deixou a saraiva. (Êxodo)","estende"
"Então o Senhor __________ um vento ocidental fortíssimo, o qual levantou os gafanhotos e os lançou no Mar Vermelho; (Êxodo)","trouxe"
"O Senhor, porém, __________ o coração de Faraó, e este não deixou ir os filhos de Israel. (Êxodo)","endureceu"
"Não se viram uns aos outros, e __________ se levantou do seu lugar por três dias; (Êxodo)","ninguém"
"Ide, __________ ao Senhor; somente fiquem os vossos rebanhos e o vosso gado; (Êxodo)","servi"
"Tu também nos __________ de dar nas mãos sacrifícios e holocaustos, para que possamos oferecer sacrifícios ao Senhor nosso Deus. (Êxodo)","tens"
"Ainda mais uma praga __________ sobre Faraó, e sobre o Egito; (Êxodo)","trarei"
"Além disso o varão __________ era mui grande na terra do Egito, aos olhos dos servos de Faraó e aos olhos do povo. (Êxodo)","Moisés"
"Mas contra os filhos de Israel nem mesmo um cão __________ a sua língua, nem contra homem nem contra animal; (Êxodo)","moverá"
"E __________ saiu da presença de Faraó ardendo em ira. (Êxodo)","Moisés"
"E __________ e Arão fizeram todas estas maravilhas diante de Faraó; (Êxodo)","Moisés"
"Ao décimo dia deste mês __________ cada um para si um cordeiro, segundo as casas dos pais, um cordeiro para cada família. (Êxodo)","tomará"
