"São __________ os filhos de Ana: Disom e Aolíbama, filha de Ana. (Gênesis)","estes"
"São __________ os filhos de Disom: Hendã, Esbã, Itrã e Querã. (Gênesis)","estes"
"São __________ os reis que reinaram na terra de Edom, antes que reinasse rei algum sobre os filhos de Israel. (Gênesis)","estes"
"Morreu Belá; e Jobabe, filho de Zerá de Bozra, __________ em seu lugar. (Gênesis)","reinou"
"Morreu Jobabe; e Husão, da terra dos temanitas, __________ em seu lugar. (Gênesis)","reinou"
"Morreu Husão; e em seu lugar __________ Hadade, filho de Bedade, que feriu a Midiã no campo de Moabe; (Gênesis)","reinou"
"Morreu Hadade; e Sâmela de Masreca __________ em seu lugar. (Gênesis)","reinou"
"Morreu Sâmela; e Saul de Reobote junto ao rio __________ em seu lugar. (Gênesis)","reinou"
"Morreu Saul; e Baal-Hanã, filho de Acbor, __________ em seu lugar. (Gênesis)","reinou"
"Jacó __________ na terra das peregrinações de seu pai, na terra de Canaã. (Gênesis)","habitava"
"Israel __________ a José do que a todos os seus filhos, porque era filho da sua velhice; (Gênesis)","amava mais"
"José __________ um sonho, que contou a seus irmãos; (Gênesis)","teve"
"Estávamos nós __________ molhos no campo, e eis que o meu molho, levantando-se, ficou em pé; e os vossos molhos o rodeavam, e se inclinavam ao meu molho. (Gênesis)","atando"
"Por isso ainda mais o __________ por causa dos seus sonhos e das suas palavras. (Gênesis)","odiavam"
"Seus irmãos, pois, o invejavam; mas seu pai __________ o caso no seu coração. (Gênesis)","guardava"
"Ora, foram seus irmãos __________ o rebanho de seu pai, em Siquém. (Gênesis)","apascentar"
"Assim o enviou do vale de Hebrom; e José foi __________. (Gênesis)","a Siquém"
"E um homem __________ a José, que andava errante pelo campo, e perguntou-lhe: Que procuras? (Gênesis)","encontrou"
"Não __________; lançai-o nesta cova, que está no deserto, e não lanceis mão nele. (Gênesis)","derrameis sangue"
"Logo que José chegou a seus irmãos, estes o despiram da sua túnica, a túnica de várias cores, que ele trazia; e tomando-o, lançaram-no na __________; (Gênesis)","cova"
"De que nos __________ matar nosso irmão e encobrir o seu sangue? (Gênesis)","aproveita"
"Ao passarem os negociantes midianitas, __________ José, alçando-o da cova, e venderam-no por vinte siclos de prata aos ismaelitas, os quais o levaram para o Egito. (Gênesis)","tiraram"
"Ora, Rúben voltou à cova, e eis que José não estava na __________; (Gênesis)","cova"
"Então Jacó __________ as suas vestes, e pôs saco sobre os seus lombos e lamentou seu filho por muitos dias. (Gênesis)","rasgou"
"E __________ todos os seus filhos e todas as suas filhas, para o consolarem; (Gênesis)","levantaram-se"
"Na verdade, com choro hei de __________ para meu filho até o Seol. (Gênesis)","descer"
"Os midianitas __________ José no Egito a Potifar, oficial de Faraó, capitão da guarda. (Gênesis)","venderam"
"Nesse tempo Judá __________ de entre seus irmãos e entrou na casa dum adulamita, que se chamava Hira, e viu Judá ali a filha de um cananeu, que se chamava Suá; (Gênesis)","desceu"
"Ela __________ e teve um filho, e o pai chamou-lhe Er. (Gênesis)","concebeu"
"Depois Judá __________ para Er, o seu primogênito, uma mulher, por nome Tamar. (Gênesis)","tomou"
"Onã, porém, __________ que tal descendência não havia de ser para ele; (Gênesis)","sabia"
"E o que ele __________ era mau aos olhos do Senhor, pelo que o matou também a ele. (Gênesis)","fazia"
"Assim se foi __________ e morou em casa de seu pai. (Gênesis)","Tamar"
"Com o correr do tempo, __________ a filha de Suá, mulher de Judá. (Gênesis)","morreu"
"Depois de consolado, Judá __________ a Timnate para ir ter com os tosquiadores das suas ovelhas, ele e Hira seu amigo, o adulamita. (Gênesis)","subiu"
"Eis que o teu sogro __________ a Timnate para tosquiar as suas ovelhas. (Gênesis)","sobe"
"Então ela __________ dos vestidos da sua viuvez e se cobriu com o véu, e assim envolvida, assentou-se à porta de Enaim que está no caminho de Timnate; (Gênesis)","se despiu"
"Ao vê-la, Judá julgou que era __________, porque ela havia coberto o rosto. (Gênesis)","uma prostituta"
"O teu selo com a corda, e o cajado que está em __________. (Gênesis)","tua mão"
"Depois Judá __________ o cabrito por mão do seu amigo o adulamita, para receber o penhor da mão da mulher; (Gênesis)","enviou"
"Onde está __________ que estava em Enaim junto ao caminho? (Gênesis)","a prostituta"
"Mas o Senhor era com José, e ele tornou-se próspero; e estava na __________ do seu senhor, o egípcio. (Gênesis)","casa"
"Assim José __________ graça aos olhos dele, e o servia; (Gênesis)","achou"
"Desde que o pôs como mordomo sobre a sua casa e sobre todos os seus bens, o Senhor __________ a casa do egípcio por amor de José; e a bênção do Senhor estava sobre tudo o que tinha, tanto na casa como no campo. (Gênesis)","abençoou"
"Potifar __________ tudo na mão de José, de maneira que nada sabia do que estava com ele, a não ser do pão que comia. (Gênesis)","deixou"
"E __________ destas coisas que a mulher do seu senhor pôs os olhos em José, e lhe disse: Deita-te comigo. (Gênesis)","aconteceu depois"
"Eis que o meu senhor __________ o que está comigo na sua casa, e entregou em minha mão tudo o que tem; (Gênesis)","não sabe"
"Como, pois, posso eu __________ este grande mal, e pecar contra Deus? (Gênesis)","cometer"
"Mas __________, certo dia, que entrou na casa para fazer o seu serviço; (Gênesis)","sucedeu"
"Mas ele, deixando a capa na mão dela, __________, escapando para fora. (Gênesis)","fugiu"
"Vede! meu marido __________ um hebreu para nos insultar; (Gênesis)","trouxe-nos"
"Vem, deixa-me __________, aqui a sua capa e fugiu, escapando para fora. (Gênesis)","deixou"
"Ela __________ a capa consigo, até que o senhor dele voltou a casa. (Gênesis)","guardou"
"O servo __________, que nos trouxeste, veio a mim para me insultar; (Gênesis)","hebreu"
"Então o senhor de José o __________, e o lançou no cárcere, no lugar em que os presos do rei estavam encarcerados; (Gênesis)","tomou"
"O Senhor, porém, era com __________, estendendo sobre ele a sua benignidade e dando-lhe graça aos olhos do carcereiro, o qual entregou na mão de José todos os presos que estavam no cárcere; e era José quem ordenava tudo o que se fazia ali. (Gênesis)","José"
"E o carcereiro __________ cuidado de coisa alguma que estava na mão de José, porquanto o Senhor era com ele, fazendo prosperar tudo quanto ele empreendia. (Gênesis)","não tinha"
"Pelo que se indignou Faraó contra os seus dois oficiais, contra o copeiro-mor e contra o padeiro-mor; e mandou detê-los na casa do capitão da guarda, no __________ onde José estava preso; (Gênesis)","cárcere"
"Eis que em meu sonho __________ uma vide diante de mim, e na vide três sarmentos; (Gênesis)","havia"
"O copo de Faraó estava na minha mão; e, tomando as uvas, eu as espremia no copo de Faraó e __________ o copo na mão de Faraó. (Gênesis)","entregava"
"Faraó __________ a tua cabeça, e te restaurará ao teu cargo; (Gênesis)","levantará"
"Mas __________ de mim, quando te for bem; usa, peço-te, de compaixão para comigo e faze menção de mim a Faraó e tira-me desta casa; (Gênesis)","lembra-te"
"Eu __________, e eis que três cestos de pão branco estavam sobre a minha cabeça. (Gênesis)","também sonhei"
"E no __________ mais alto havia para Faraó manjares de todas as qualidades que fazem os padeiros; (Gênesis)","cesto"
"E __________ ao terceiro dia, o dia natalício de Faraó, que este deu um banquete a todos os seus servos; e levantou a cabeça do copeiro-mor, e a cabeça do padeiro-mor no meio dos seus servos; (Gênesis)","aconteceu"
"O copeiro-mor, porém, __________ de José, antes se esqueceu dele. (Gênesis)","não se lembrou"
"Passados dois anos inteiros, Faraó sonhou que estava em __________ ao rio Nilo; (Gênesis)","pé junto"
"Após elas __________ do rio outras sete vacas, feias à vista e magras de carne; e paravam junto às outras vacas à beira do Nilo. (Gênesis)","subiam"
"E as vacas feias à vista e magras de carne __________ as sete formosas à vista e gordas. (Gênesis)","devoravam"
"Após elas __________ sete espigas miúdas e queimadas do vento oriental; (Gênesis)","brotavam"
"Faraó __________ os seus sonhos, mas não havia quem lhos interpretasse. (Gênesis)","contou-lhes"
"Estavam no __________ da casa de seu senhor, dizendo vossos semblantes tão tristes hoje? (Gênesis)","cárcere"
"Faraó estava __________ contra os seus servos, e entregou-me à prisão na casa do capitão da guarda, a mim e ao padeiro chefe. (Gênesis)","muito indignado"
"Estava __________ um moço hebreu, servo do capitão da guarda, e contamos-lhe os sonhos, e ele interpretou os nossos sonhos, a cada um interpretou conforme o seu sonho. (Gênesis)","ali conosco"
"Então Faraó __________ chamar a José, e o fizeram sair apressadamente da masmorra. (Gênesis)","mandou"
"Ele se barbeou, __________ de roupa e apresentou-se a Faraó. (Gênesis)","mudou"
"Mas de ti __________ dizer que, ouvindo contar um sonho, podes interpretá-lo. (Gênesis)","ouvi"
"Isso não está em mim, mas Deus é que __________ uma resposta de paz a Faraó. (Gênesis)","dará"
"Após elas __________ outras sete vacas, fracas, muito feias à vista e magras de carne, tão feias quais nunca vi em toda terra do Egito. (Gênesis)","subiam"
"As vacas magras e feias __________ as primeiras sete vacas gordas. (Gênesis)","devoravam"
"Mas depois de as terem consumido, não se __________ que as houvessem consumido; (Gênesis)","podia reconhecer"
"Após elas __________ sete espigas secas, miúdas e queimadas do vento oriental. (Gênesis)","brotavam"
"As sete espigas miúdas __________ as sete espigas boas. (Gênesis)","devoravam"
"Contei-o aos magos, mas não houve quem o __________. (Gênesis)","interpretasse"
"As sete vacas boas são sete anos, e as sete espigas boas também são sete anos; o sonho é __________. (Gênesis)","um só"
"Esta é __________ que eu disse a Faraó: o que Deus há de fazer mostro-o a Faraó. (Gênesis)","a palavra"
"Depois deles __________ sete anos de fome, e toda aquela fartura será esquecida na terra do Egito, e a fome consumirá a terra. (Gênesis)","levantar-se-ão"
"Não será conhecida a abundância na terra, por causa daquela fome que seguirá; porquanto será __________. (Gênesis)","gravíssima"
"Portanto, proveja-se __________ de um homem entendido e sábio, e o ponha sobre a terra do Egito. (Gênesis)","agora Faraó"
"Tu estarás sobre a minha casa, e por tua voz __________ todo o meu povo; (Gênesis)","se governará"
"E Faraó __________ da mão o seu anel-sinete e pô-lo na mão de José, vestiu-o de traje de linho fino, e lhe pôs ao pescoço um colar de ouro. (Gênesis)","tirou"
"Faraó __________ a José Zafnate-Paneã, e deu-lhe por mulher Asenate, filha de Potífera, sacerdote de Om. (Gênesis)","chamou"
"Ora, José era da __________ de trinta anos, quando se apresentou a Faraó, rei do Egito. (Gênesis)","idade"
"E __________ José da presença de Faraó e passou por toda a terra do Egito. (Gênesis)","saiu"
"Durante os sete anos de fartura a terra __________ com abundância; e José ajuntou todo o mantimento dos sete anos, que houve na terra do Egito, e o guardou nas cidades; (Gênesis)","produziu"
"Assim José __________ muitíssimo trigo, como a areia do mar, até que cessou de contar; (Gênesis)","ajuntou"
"Antes que viesse o ano da fome, __________ a José dois filhos, que lhe deu Asenate, filha de Potífera, sacerdote de Om. (Gênesis)","nasceram"
"Depois toda a terra do Egito __________ fome, e o povo clamou a Faraó por pão; (Gênesis)","teve"
"De __________ que, havendo fome sobre toda a terra, abriu José todos os depósitos, e vendia aos egípcios; (Gênesis)","modo"
"Também de todas as terras __________ ao Egito, para comprarem de José; (Gênesis)","vinham"
"Para que, porventura, não lhe __________ algum desastre. (Gênesis)","suceda"
"Assim entre os que iam lá, foram __________ de Israel para comprar, porque havia fome na terra de Canaã. (Gênesis)","os filhos"
"Vós __________, e viestes para ver a nudez da terra. (Gênesis)","sois espias"
"Nós, teus servos, somos __________, filhos de um homem da terra de Canaã; (Gênesis)","doze irmãos"
"Se __________ homens de retidão, que fique um dos irmãos preso na casa da vossa prisão; (Gênesis)","sois"
"Nós, na verdade, somos __________ no tocante a nosso irmão, porquanto vimos a angústia da sua alma, quando nos rogava, e não o quisemos atender; (Gênesis)","culpados"
"E eles __________ que José os entendia, porque havia intérprete entre eles. (Gênesis)","não sabiam"
"Eles, pois, __________ o trigo sobre os seus jumentos, e partiram dali. (Gênesis)","carregaram"
"Quando um deles __________ o saco, para dar forragem ao seu jumento na estalagem, viu o seu dinheiro, pois estava na boca do saco. (Gênesis)","abriu"
"Meu dinheiro foi-me __________; ei-lo aqui no saco. (Gênesis)","devolvido"
"O homem, o senhor da terra, __________ asperamente, e tratou-nos como espias da terra; (Gênesis)","falou-nos"
"E __________ que, despejando eles os sacos, eis que o pacote de dinheiro de cada um estava no seu saco; (Gênesis)","aconteceu"
"Então Jacó, seu pai, __________: Tendes-me desfilhado; (Gênesis)","disse-lhes"
"José __________, e não existe Simeão, e haveis de levar Benjamim! (Gênesis)","já não existe"
"Se lhe suceder algum desastre pelo caminho em que fordes, fareis __________ minhas cãs com tristeza ao Seol. (Gênesis)","descer"
"Se queres enviar conosco o nosso irmão, __________ e te compraremos alimento; (Gênesis)","desceremos"
"Por que me __________ este mal, fazendo saber ao homem que tínheis ainda outro irmão? (Gênesis)","fizeste"
"Se eu to __________, e o não puser diante de ti, serei réu de crime para contigo para sempre. (Gênesis)","não trouxer"
"E se não nos __________, certamente já segunda vez estaríamos de volta. (Gênesis)","tivéssemos demorado"
"Então os homens __________ medo, por terem sido levados à casa de José; (Gênesis)","tiveram"
"Ai! senhor meu, na verdade descemos dantes a comprar mantimento; e quando chegamos à estalagem, abrimos os nossos sacos, e eis que o dinheiro de cada um estava na __________ do seu saco, nosso dinheiro por seu peso; e tornamos a trazê-lo em nossas mãos; (Gênesis)","boca"
"Então eles __________ o presente para quando José viesse ao meio-dia; (Gênesis)","prepararam"
"Quando José __________ em casa, trouxeram-lhe ali o presente que guardavam junto de si; (Gênesis)","chegou"
"Então ele lhes __________ estavam; e prosseguiu: vosso pai, o ancião de quem falastes, está bem? (Gênesis)","perguntou como"
"É __________ o vosso irmão mais novo de quem me falastes? (Gênesis)","este"
"E __________: Deus seja benévolo para contigo, meu filho. (Gênesis)","disse"
"E José __________, porque se lhe comoveram as entranhas por causa de seu irmão, e procurou onde chorar; (Gênesis)","apressou-se"
"Então ele lhes __________ as porções que estavam diante dele; (Gênesis)","apresentou"
"E a minha taça de prata porás na boca do saco do __________, com o dinheiro do seu trigo. (Gênesis)","mais novo"
"Logo que veio a luz da manhã, foram __________ os homens, eles com os seus jumentos. (Gênesis)","despedidos"
"Não é __________ a taça por que bebe meu senhor, e de que se serve para adivinhar? (Gênesis)","esta"
"Então ele, tendo-os alcançado, lhes __________ essas mesmas palavras. (Gênesis)","falou"
"Longe estejam __________ de fazerem semelhante coisa. (Gênesis)","teus servos"
"Eis que o dinheiro, que achamos nas bocas dos nossos sacos, to tornamos a __________ desde a terra de Canaã; (Gênesis)","trazer"
"Aquele dos __________ com quem a taça for encontrada, morra; e ainda nós seremos escravos do meu senhor. (Gênesis)","teus servos"
"Então eles __________ cada um a pôr em terra o seu saco, e cada um a abri-lo. (Gênesis)","se apressaram"
"E o despenseiro __________, começando pelo maior, e acabando pelo mais novo; (Gênesis)","buscou"
"A menos que desça convosco vosso irmão mais novo, __________ a minha face. (Gênesis)","nunca mais vereis"
"Agora, pois, se eu for ter com o teu servo, meu pai, e o menino não estiver conosco, como a sua alma está ligada com a alma dele, __________ que, vendo ele que o menino ali não está, morrerá; (Gênesis)","acontecerá"
"Se eu to não trouxer de volta, serei __________, para com meu pai para sempre. (Gênesis)","culpado"
"Agora, pois, __________ teu servo em lugar do menino como escravo de meu senhor, e que suba o menino com seus irmãos. (Gênesis)","fique"
"Porque, como subirei eu a meu pai, se o menino não for __________? (Gênesis)","comigo"
"Fazei a todos sair da minha presença; e ninguém __________ com ele, quando se deu a conhecer a seus irmãos. (Gênesis)","ficou"
"E __________ a voz em choro, de maneira que os egípcios o ouviram, bem como a casa de Faraó. (Gênesis)","levantou"
"E seus irmãos não lhe __________ responder, pois estavam pasmados diante dele. (Gênesis)","puderam"
"José __________ a seus irmãos: Chegai-vos a mim, peço-vos. (Gênesis)","disse mais"
"Eu sou __________, vosso irmão, a quem vendestes para o Egito. (Gênesis)","José"
"Agora, pois, não vos __________, nem vos aborreçais por me haverdes vendido para cá; porque para preservar vida é que Deus me enviou adiante de vós. (Gênesis)","entristeçais"
"Porque __________ dois anos de fome na terra, e ainda restam cinco anos em que não haverá lavoura nem sega. (Gênesis)","já houve"
"Deus __________ adiante de vós, para conservar-vos descendência na terra, e para guardar-vos em vida por um grande livramento. (Gênesis)","enviou-me"
"Deus me __________ por senhor de toda a terra do Egito; (Gênesis)","tem posto"
"Eis que os vossos olhos, e os de meu irmão Benjamim, vêem que é __________ que vos fala. (Gênesis)","minha boca"
"E José __________ a todos os seus irmãos, chorando sobre eles; (Gênesis)","beijou"
"E não vos __________ coisa alguma das vossas alfaias; (Gênesis)","pese"
"E a seu pai __________ o seguinte: dez jumentos carregados do melhor do Egito, e dez jumentas carregadas de trigo, pão e provisão para seu pai, para o caminho. (Gênesis)","enviou"
"José __________, e é governador de toda a terra do Egito. (Gênesis)","ainda vive"
"E o seu coração __________, porque não os acreditava. (Gênesis)","desmaiou"
"Eu __________ contigo para o Egito, e certamente te farei tornar a subir; e José porá a sua mão sobre os teus olhos. (Gênesis)","descerei"
"Os seus filhos e os filhos de seus filhos com ele, as suas filhas e as filhas de seus filhos, e toda a sua descendência, __________ consigo para o Egito. (Gênesis)","levou-os"
"São __________ os nomes dos filhos de Israel, que vieram para o Egito, Jacó e seus filhos: Rúben, o primogênito de Jacó. (Gênesis)","estes"
"E __________ de Rúben: Hanoque, Palu, Hezrom e Carmi. (Gênesis)","os filhos"
"E __________ de Simeão: Jemuel, Jamim, Oade, Jaquim, Zoar, e Saul, filho de uma mulher cananéia. (Gênesis)","os filhos"
"E os filhos de Pérez foram __________ e Hamul, E os filhos de Issacar: Tola, Puva, Iobe e Sinrom. (Gênesis)","Hezrom"
"Estes são __________ de Léia, que ela deu a Jacó em Padã-Arã, além de Diná, sua filha; (Gênesis)","os filhos"
"E __________ de Gade: Zifiom, Hagui, Suni, Ezbom, Eri, Arodi e Areli. (Gênesis)","os filhos"
"Estes são __________ de Zilpa, a qual Labão deu à sua filha Léia; (Gênesis)","os filhos"
"E __________ a José na terra do Egito Manassés e Efraim, que lhe deu Asenate, filha de Potífera, sacerdote de Om. (Gênesis)","nasceram"
"E __________ de Benjamim: Belá, Bequer, Asbel, Gêra, Naamã, Eí, Ros, Mupim, Hupim e Arde. (Gênesis)","os filhos"
"Estes são __________ de Raquel, que nasceram a Jacó, ao todo catorze almas. (Gênesis)","os filhos"
"Estes são __________ de Bila, a qual Labão deu à sua filha Raquel; (Gênesis)","os filhos"
"Todas as almas que vieram com Jacó para o Egito e que saíram da sua coxa, fora as mulheres dos filhos de Jacó, eram todas __________ e seis almas; (Gênesis)","sessenta"
"Todas as almas da casa de Jacó, que vieram para o Egito eram __________. (Gênesis)","setenta"
"Ora, Jacó __________ Judá adiante de si a José, para o encaminhar a Gósen; e chegaram à terra de Gósen. (Gênesis)","enviou"
"Então José __________ o seu carro, e subiu ao encontro de Israel, seu pai, a Gósen; (Gênesis)","aprontou"
"Meus irmãos e a casa de meu pai, que estavam na terra de Canaã, __________ para mim. (Gênesis)","vieram"
"Os homens são __________, que se ocupam em apascentar gado; e trouxeram os seus rebanhos, o seu gado e tudo o que têm. (Gênesis)","pastores"
"Nós, teus servos, temos sido __________ de gado desde a nossa mocidade até agora, tanto nós como nossos pais. (Gênesis)","pastores"
"Isso __________ para que habiteis na terra de Gósen; (Gênesis)","direis"
"Meu pai e meus irmãos, com seus rebanhos e seu gado, e tudo o que têm, __________ da terra de Canaã e estão na terra de Gósen. (Gênesis)","chegaram"
"E __________ dentre seus irmãos cinco homens e os apresentou a Faraó. (Gênesis)","tomou"
"Que ocupação é a vossa; Responderam-lhe: Nós, teus servos, somos __________ de ovelhas, tanto nós como nossos pais. (Gênesis)","pastores"
"E se sabes que entre eles há homens capazes, __________ sobre os pastores do meu gado. (Gênesis)","põe-nos"
"Também José __________ a Jacó, seu pai, e o apresentou a Faraó; e Jacó abençoou a Faraó. (Gênesis)","introduziu"
"Os dias dos anos das minhas peregrinações são __________ e trinta anos; poucos e maus têm sido os dias dos anos da minha vida, e não chegaram aos dias dos anos da vida de meus pais nos dias das suas peregrinações. (Gênesis)","cento"
"José, pois, __________ a seu pai e seus irmãos, dando-lhes possessão na terra do Egito, no melhor da terra, na terra de Ramessés, como Faraó ordenara. (Gênesis)","estabeleceu"
"E José __________ de pão seu pai, seus irmãos e toda a casa de seu pai, segundo o número de seus filhos. (Gênesis)","sustentou"
"Ora, não havia pão em toda a terra, porque a fome era mui __________; (Gênesis)","grave"
"Então José __________ todo o dinheiro que se achou na terra do Egito, e na terra de Canaã, pelo trigo que compravam; e José trouxe o dinheiro à casa de Faraó. (Gênesis)","recolheu"
"Trazei o vosso gado, e vo-lo darei por vosso gado, se __________ o dinheiro. (Gênesis)","falta"
"Compra-nos a nós e a nossa terra em troca de pão, e nós e a nossa terra seremos servos de Faraó; __________ também semente, para que vivamos e não morramos, e para que a terra não fique desolada. (Gênesis)","dá-nos"
"Assim José __________ toda a terra do Egito para Faraó; (Gênesis)","comprou"
"Quanto ao povo, José fê-lo __________ às cidades, desde uma até a outra extremidade dos confins do Egito. (Gênesis)","passar"
"Somente a terra dos sacerdotes não a __________, porquanto os sacerdotes tinham rações de Faraó, e eles comiam as suas rações que Faraó lhes havia dado; (Gênesis)","comprou"
"Hoje vos __________ a vós e a vossa terra para Faraó; (Gênesis)","tenho comprado"
"Há de ser, porém, que no __________ as colheitas dareis a quinta parte a Faraó, e quatro partes serão vossas, para semente do campo, e para o vosso mantimento e dos que estão nas vossas casas, e para o mantimento de vossos filhinho. (Gênesis)","tempo"
"José, pois, __________ isto por estatuto quanto ao solo do Egito, até o dia de hoje, que a Faraó coubesse o quinto a produção; (Gênesis)","estabeleceu"
"E Jacó __________ na terra do Egito dezessete anos; (Gênesis)","viveu"
"Então José __________ consigo os seus dois filhos, Manassés e Efraim. (Gênesis)","tomou"
"Eis que te __________ frutificar e te multiplicarei; tornar-te-ei uma multidão de povos e darei esta terra à tua descendência depois de ti, em possessão perpétua. (Gênesis)","farei"
"Efraim e Manassés serão __________, como Rúben e Simeão; mas a prole que tiveres depois deles será tua; (Gênesis)","meus"
"Quando eu vinha de Padã, __________ Raquel no caminho, na terra de Canaã, quando ainda faltava alguma distância para chegar a Efrata; (Gênesis)","morreu-me"
"Os olhos de Israel, porém, __________ por causa da velhice, de modo que não podia ver. (Gênesis)","se tinham escurecido"
"José, pois, fê-los __________ a ele; e ele os beijou e os abraçou. (Gênesis)","chegar"
"Então José os tirou dos joelhos de seu pai; e inclinou-se __________ da sua face. (Gênesis)","à terra diante"
"E José __________ os dois, a Efraim com a sua mão direita, à esquerda de Israel, e a Manassés com a sua mão esquerda, à direita de Israel, e assim os fez chegar a ele. (Gênesis)","tomou"
"Mas Israel, estendendo a mão direita, __________ sobre a cabeça de Efraim, que era o menor, e a esquerda sobre a cabeça de Manassés, dirigindo as mãos assim propositadamente, sendo embora este o primogênito. (Gênesis)","colocou-a"
"O Deus em cuja presença andaram os meus pais Abraão e Isaque, o Deus que tem sido o meu pastor durante toda a minha vida até este dia, o anjo que me __________ de todo o mal, abençoe estes mancebos, e seja chamado neles o meu nome, e o nome de meus pois Abraão e Isaque; e multipliquem-se abundantemente no meio da terra. (Gênesis)","tem livrado"
"Vendo José que seu pai colocava a mão direita sobre a cabeça de Efraim, foi-lhe isso __________; levantou, pois, a mão de seu pai, para a transpor da cabeça de Efraim para a cabeça de Manassés. (Gênesis)","desagradável"
"Eu o sei, meu filho, eu o sei; ele __________ um povo, ele também será grande; (Gênesis)","também se tornará"
